url,name,description,language,Category,blockchain
https://api.github.com/repos/block42-blockchain-company/smart-wedding-contract,smart-wedding-contract,A smart marriage contract on Ethereum.,JavaScript,Others,ethereum
https://api.github.com/repos/tomochain/tomomaster,tomomaster,"Validators Voting Contracts, Governance DApps",Vue,Others,ethereum
https://api.github.com/repos/cointastical/P2P-Trading-Exchanges,P2P-Trading-Exchanges,Person-to-Person bitcoin Trading Exchanges,,Crypto,bitcoin
https://api.github.com/repos/aeternity/aepp-blockchain-explorer,aepp-blockchain-explorer,,,Others,others
https://api.github.com/repos/mzollin/qr-pirate,qr-pirate,crawl QR-codes from search engines and look for bitcoin private keys,Python,Others,bitcoin
https://api.github.com/repos/dharma-eng/dharma-token,dharma-token,"Implementation and testing for core Dharma Token (dToken) contracts, including Dharma Dai and Dharma USD Coin.",JavaScript,Crypto,multi
https://api.github.com/repos/mmgen/MMGenLive,MMGenLive,A bootable USB image of the MMGen online/offline Bitcoin wallet,,Crypto,bitcoin
https://api.github.com/repos/decred/dcrtime,dcrtime,"Decred anchored timestamp client, proxy and server.",,Others,decred
https://api.github.com/repos/IPCChain/ipchain,ipchain,ipchain is a blockchain used in intellectual property right protection.,,Others,others
https://api.github.com/repos/qtumproject/qtum-web-wallet,qtum-web-wallet,A web wallet for QTUM,Vue,Crypto,qtum
https://api.github.com/repos/slockit/dao-dapp,dao-dapp,,HTML,Others,ethereum
https://api.github.com/repos/ontio/ontology-explorer,ontology-explorer,Ontology blockchain explorer,,Others,ontology
https://api.github.com/repos/poanetwork/poa-dapps-voting,poa-dapps-voting,POA Network voting Dapp,JavaScript,Others,others
https://api.github.com/repos/bitpay/bitpay-go,bitpay-go,"Powerful, flexible, lightweight interface to the BitPay Bitcoin Payment Gateway API.",Go,Crypto,bitcoin
https://api.github.com/repos/nasa8x/node-genesis-block,node-genesis-block,"Create Genesis Block for Bitcoin, Litcoin, Dash, X11, X13, X15, X17, Geek, Quark, Keccak, Qubit, NeoScrypt, Scrypt...",,Crypto,multi
https://api.github.com/repos/arcbtc/bowser-bitcoin-hardware-wallet,bowser-bitcoin-hardware-wallet,ESP32 Hardware Wallet,C,Crypto,bitcoin
https://api.github.com/repos/LedgerHQ/ledger-app-eth,ledger-app-eth,Ethereum wallet application for Ledger Blue and Nano S,C,Crypto,ethereum
https://api.github.com/repos/m4r1vs/CRYPT,CRYPT,⚡CRYPT is the first idiot-proof lightning-enabled bitcoin wallet that just works!,JavaScript,Crypto,bitcoin
https://api.github.com/repos/bitcoinj/httpseed,httpseed,Cartographer: A new type of seed for the Bitcoin network,Kotlin,Crypto,bitcoin
https://api.github.com/repos/marbleprotocol/humanity,humanity,Unique identity on Ethereum,TypeScript,Others,ethereum
https://api.github.com/repos/dappuniversity/social-network,social-network,Blockchain social network powered by Ethereum smart contracts,JavaScript,Others,ethereum
https://api.github.com/repos/xingkaichun/HelloworldBlockchain,HelloworldBlockchain,,Java,Crypto,others
https://api.github.com/repos/CurrencyTycoon/eth-hodler,eth-hodler,A simple DApp & ERC20 token written in Solidity running on the Ethereum blockchain www.hdao.org,,Others,ethereum
https://api.github.com/repos/AdChain/AdChainRegistryDapp,AdChainRegistryDapp,adChain Registry dApp,JavaScript,Others,ethereum
https://api.github.com/repos/OmniProject/Omni,Omni,Holochain dApp for academic publishing. Facilitates peer-reviewing of articles and dissemination of knowledge ,,Others,others
https://api.github.com/repos/horizontalsystems/ethereum-kit-ios,ethereum-kit-ios,Open-source fully functional wallet implementation for Ethereum protocol. Using this toolkit you can built ethereum + ERC 20 token wallet in no time :),,Crypto,ethereum
https://api.github.com/repos/gcash/bchwallet,bchwallet,A secure bitcoin cash wallet daemon written in Go (golang),Go,Crypto,multi
https://api.github.com/repos/PierreRochard/bitcoin-acks,bitcoin-acks,,Python,Others,bitcoin
https://api.github.com/repos/iotaledger/spark-wallet,spark-wallet,A low-security wallet intended for short-term use and to send small amounts of IOTA tokens,HTML,Crypto,iota
https://api.github.com/repos/emre/dpoll.xyz,dpoll.xyz,Decentralized poll app on the top STEEM blockchain,Python,Others,others
https://api.github.com/repos/openberry-ac/instagram,instagram,Create an Instagram-like DApp with IPFS ,JavaScript,Others,others
https://api.github.com/repos/simondlr/thisartworkisalwaysonsale,thisartworkisalwaysonsale,A digital art project on Ethereum that uses harberger tax to have an always-on auction. Tax is patronage to artist.,,Others,ethereum
https://api.github.com/repos/philipperemy/bitcoin-market-data,bitcoin-market-data,Largest up-to-date market data database for Bitcoin (mirror server of bitcoincharts),,Crypto,bitcoin
https://api.github.com/repos/coinolio/coinolio,coinolio,"Bitcoin and Altcoin trades logging and tracking. Including Profit / Loss calculations, Price Charts and realtime updates.",,Crypto,multi
https://api.github.com/repos/IBM/fabric-contract-attribute-based-access-control,fabric-contract-attribute-based-access-control,A repo to demonstrate how to implement attribute-based-access-control in Hyperledger Fabric for a supply-chain use case using IBM Blockchain Platform VSCode extension.,JavaScript,Others,hyperledger fabric
https://api.github.com/repos/lukechilds/build-output-script,build-output-script,Builds a P2PKH Bitcoin transaction output script,JavaScript,Crypto,bitcoin
https://api.github.com/repos/curly60e/pyblock,pyblock,Bitcoin Blockclock ,Python,Crypto,bitcoin
https://api.github.com/repos/LayerXcom/hyperledger-fabric-security-dvp,hyperledger-fabric-security-dvp,Implementation of Security DvP,Shell,Crypto,hyperledger fabric
https://api.github.com/repos/lbtcio/lbtc-core,lbtc-core,Linghtning Bitcoin,C,Crypto,bitcoin
https://api.github.com/repos/amand1996/Votechain,Votechain,Decentralised Elections using Blockchain,,Crypto,others
https://api.github.com/repos/essentiaone/Essentia-iOS,Essentia-iOS,All in One Blockchain solution ,Swift,Others,multi
https://api.github.com/repos/reach-sh/reach-lang,reach-lang,DApps as Easy as Apps: Blockchain for Everyone,Haskell,Others,others
https://api.github.com/repos/tintinweb/smart-contract-sanctuary,smart-contract-sanctuary,???????????????????? That place where ethereum smart contracts feel home.,,Others,ethereum
https://api.github.com/repos/wealdtech/wealdtech-solidity,wealdtech-solidity,,JavaScript,Others,ethereum
https://api.github.com/repos/sc0Vu/vuethexplore,vuethexplore,Vue project for ethereum blockchain explore.,,Others,ethereum
https://api.github.com/repos/oleiba/RSA-accumulator,RSA-accumulator,"Cryptographic accumulator based on the strong RSA assumption, Python & Solidity",,Crypto,tron
https://api.github.com/repos/ssimunic/iot-device-management,iot-device-management,"Using Ethereum blockchain platform for identity, authentication and reputation of IoT devices",JavaScript,Crypto,ethereum
https://api.github.com/repos/BlockABC/eos-semantics,eos-semantics,,,Others,eos
https://api.github.com/repos/zcash/zcash-android-wallet-sdk,zcash-android-wallet-sdk,Wallet Proof of Concept,Rust,Crypto,zcash
https://api.github.com/repos/meth/eth-hd-wallet,eth-hd-wallet,"Lightweight Ethereum HD wallet implementation according to BIP44, production-ready.",JavaScript,Crypto,ethereum
https://api.github.com/repos/darwinia-network/darwinia,darwinia,"Darwinia: The hub relay chain for the darwinia parachains and appchains, able to connect to Polkadot",,Others,polkadot
https://api.github.com/repos/radix42/winzec,winzec,A full node zcash wallet for windows,,Crypto,zcash
https://api.github.com/repos/skalenetwork/sgxwallet,sgxwallet,"sgxwallet is a next generation hardware secure crypto wallet that is based on Intel SGX technology. It currently supports Ethereum and SKALE, and will support Bitcoin in the future.  Sgxwallet is under heavy development and use by SKALE.",C++,Crypto,multi
https://api.github.com/repos/musdom/sploony,sploony,Physical front-end for the Lightning Network ⚡️,C++,Others,bitcoin
https://api.github.com/repos/emre/tagbot,tagbot,A bot rewards specific tags on Steem blockchain,Python,Crypto,others
https://api.github.com/repos/orange1337/eosweb,eosweb,EOS blockchain explorer,CSS,Others,eos
https://api.github.com/repos/evias/pacNEM,pacNEM,"pacNEM is a Browser PacMan game with NodeJS, Socket.io, Handlebars and NEM Blockchain",JavaScript,Others,nem
https://api.github.com/repos/Reidmcc/Binance-bot,Binance-bot,Python bot for trading on the Binance cryptocurrency exchange,,Crypto,binance
https://api.github.com/repos/pi0neerpat/one-click-dApp,one-click-dApp,:zap::wrench::link: :shipit: Instantly build a dApp with a simple URL to bookmark or share with a friend.,JavaScript,Others,others
https://api.github.com/repos/ankitkataria/Lottery-DApp,Lottery-DApp,:moneybag: An block-chain based Lottery System ,JavaScript,Others,ethereum
https://api.github.com/repos/monkeylord/bitcoin-ibe,bitcoin-ibe,Bitcoin  ID-Based Encryption,,Crypto,bitcoin
https://api.github.com/repos/metacartel/MCV,MCV,Ethereum's Venture DAO,,Others,ethereum
https://api.github.com/repos/somish/NexusMutual,NexusMutual,"Nexusmutual.io uses the power of blockchain technology and Ethereum to allow people from all over the world to share insurance risk together without the need for an insurance company.   Nexus Mutual will initially launch with one product, earthquake cover",,Others,ethereum
https://api.github.com/repos/paritytech/Nomidot,Nomidot,Staking Portal for Polkadot,TypeScript,Others,polkadot
https://api.github.com/repos/AlohaEOS/eos-proxyinfo,eos-proxyinfo,EOS Proxy Info Contract,,Others,eos
https://api.github.com/repos/EasyAI/Simple-Binance-Trader,Simple-Binance-Trader,,,Crypto,binance
https://api.github.com/repos/0xTracker/0x-event-extractor,0x-event-extractor,NodeJS worker application built for 0x Tracker which extracts 0x fill events from the Ethereum blockchain and persists them to MongoDB,JavaScript,Others,multi
https://api.github.com/repos/balancer-labs/balancer-exchange,balancer-exchange,Exchange dapp for token swaps,TypeScript,Crypto,ethereum
https://api.github.com/repos/invisible-college/democracy,democracy,An Ethereum distributed app (dapp) for recording work-hours and sharing a multi-signature wallet.,HTML,Crypto,ethereum
https://api.github.com/repos/altangent/lightning-viz,lightning-viz,Bitcoin Lightning Network visualizer,JavaScript,Others,bitcoin
https://api.github.com/repos/dexon-foundation/dekusan,dekusan,"DEXON wallet extension, forked from MetaMask",JavaScript,Crypto,ethereum
https://api.github.com/repos/everett-protocol/keplr-extension,keplr-extension,Keplr is a browser extension wallet for the Inter blockchain ecosystem.,TypeScript,Crypto,cosmos
https://api.github.com/repos/decentraland/explorer,explorer, ???? Explore Decentraland from a web browser,TypeScript,Others,decentraland
https://api.github.com/repos/republicprotocol/renex-sol,renex-sol,"RenEx Ethereum contracts, written in Solidity",JavaScript,Others,ethereum
https://api.github.com/repos/blockparty-sh/craft.cash,craft.cash,Draw with voxels in your browser with Bitcoin Cash and Blockparty Wallet,,Crypto,multi
https://api.github.com/repos/foxnut/go-hdwallet,go-hdwallet,A multi-cryptocurrency HD wallet implementated by golang.,Go,Crypto,multi
https://api.github.com/repos/robsecord/ChargedParticlesEth,ChargedParticlesEth,Token Contracts for Ethereum Charged Particles (Interest bearing NFTs),JavaScript,Crypto,ethereum
https://api.github.com/repos/salimane/cryptodiversify,cryptodiversify,Automatically check your portofolio on the Binance exchange and advice you on rebalancing your portfolio into the top 20 cryptocurrencies by market capitalization,,Crypto,binance
https://api.github.com/repos/jonatack/bitcoin-development,bitcoin-development,"Various notes, todos and ideas for development work on Bitcoin",,Others,bitcoin
https://api.github.com/repos/alpineintel/tcrpartybot,tcrpartybot,A Twitter bot for interacting with a TCR without knowing what a blockchain is,Go,Others,ethereum
https://api.github.com/repos/shawntabrizi/ERC-20-Token-Balance,ERC-20-Token-Balance,"This is an extension of the ""Hello World"" project for Ethereum and Web3.js which allows you to query the ERC-20 token balance of an Ethereum address.",,Crypto,ethereum
https://api.github.com/repos/allemanfredi/PEGASUS,PEGASUS," Pegasus is a chrome extension that implements a wallet for the IOTA cryptocurrency. In addition to being a wallet, Pegasus will implement a sort of marketplace where a user can buy streams of data coming from sensors connected to the IOTA network through",,Crypto,iota
https://api.github.com/repos/tasitlabs/tasit,tasit,A monorepo for all of the open source Tasit 3rd party mobile apps for Ethereum dapps,,Others,ethereum
https://api.github.com/repos/JesseBusman/PyramidGame,PyramidGame,"A decentralized Ethereum game for Mist, Parity and MetaMask. Written in Solidity and JavaScript.",,Others,ethereum
https://api.github.com/repos/andyfreer/dash-machine,dash-machine,Dash Blockchain Visualizer,,Others,dash
https://api.github.com/repos/6102bitcoin/txCast,txCast,Randomised Bitcoin transaction broadcasting to break timing analysis,Python,Crypto,bitcoin
https://api.github.com/repos/horizontalsystems/ethereum-kit-android,ethereum-kit-android,Open-source fully functional wallet implementation for Ethereum protocol. Using this toolkit you can built ethereum + ERC 20 token wallet in no time :),,Crypto,ethereum
https://api.github.com/repos/figment-networks/tezos-batch-payments,tezos-batch-payments,All-in-one script for bakers to securely batch multiple Tezos payments.,Shell,Crypto,tezos
https://api.github.com/repos/cashweb/stamp,stamp,Stamp is a Bitcoin Cash powered internet relay chat,JavaScript,Others,bitcoin cash
https://api.github.com/repos/boshdmg/Crypto-Unit-Cost-Averager,Crypto-Unit-Cost-Averager,Automatically buys Ethereum at regular intervals on gdax. (Unit cost averaging),,Crypto,ethereum
https://api.github.com/repos/electroneum/electroneum-blockchain-explorer,electroneum-blockchain-explorer,,,Others,tron
https://api.github.com/repos/bitbaba/bitgold,bitgold,alternate fork from bitcoin,,Crypto,bitcoin
https://api.github.com/repos/interstellar/kelp,kelp,Kelp is a free and open-source trading bot for the Stellar universal marketplace,Go,Crypto,stellar
https://api.github.com/repos/thalidzhokov/whmcs-blockchain,whmcs-blockchain,Blockchain.com (Bitcoin) payment gateway for WHMCS,,Crypto,bitcoin
https://api.github.com/repos/tsuzukit/meta-transaction,meta-transaction,Ethereum meta-transaction concept,,Crypto,ethereum
https://api.github.com/repos/hodlwave/proof-wallet,proof-wallet,The native PSBT multisig wrapper for Bitcoin Core.,Python,Crypto,bitcoin
https://api.github.com/repos/m0t0k1ch1/metamask-login-sample,metamask-login-sample,a sample application for testing MetaMask login built with Vue.js,,Others,ethereum
https://api.github.com/repos/KarolTrzeszczkowski/Electron-Cash-Last-Will-Plugin,Electron-Cash-Last-Will-Plugin,A plugin for creating and managing the Last Will smart contract on Bitcoin Cash blockchain,Python,Others,bitcoin cash
https://api.github.com/repos/Cryptonomic/Arronax,Arronax,Explorer for the Tezos blockchain based on the Conseil API,,Others,tezos
https://api.github.com/repos/bubelov/coins-android,coins-android,Thousands of merchants already accept Bitcoin. This app will help you find them.,Java,Others,bitcoin
https://api.github.com/repos/miguelmota/ethereum-hdwallet,ethereum-hdwallet,,,Crypto,ethereum
https://api.github.com/repos/jimpo/march-madness-dapp,march-madness-dapp,Decentralized March Madness bracket pool application.,JavaScript,Crypto,ethereum
https://api.github.com/repos/SigwoTechnologies/explorer,explorer,Blockchain explorer,,Others,others
https://api.github.com/repos/authereum/eth-revert-reason,eth-revert-reason,Get the revert reason from an Ethereum transaction hash,JavaScript,Crypto,ethereum
https://api.github.com/repos/hodlwallet/hodl-wallet-ios,hodl-wallet-ios,Hodl Mobile Bitcoin Wallet,Swift,Crypto,bitcoin
https://api.github.com/repos/Bitlits/Bitcoin-Casino,Bitcoin-Casino,⚛️ Open source cryptocurrency casino.,PHP,Crypto,bitcoin
https://api.github.com/repos/Dragonfly-Capital/oracles.club,oracles.club,the only club you need to join for ethereum oracle data,CSS,Others,ethereum
https://api.github.com/repos/thetatoken/theta-infrastructure-ledger-explorer,theta-infrastructure-ledger-explorer,Explorer for the Theta Ledger,JavaScript,Others,theta
https://api.github.com/repos/ethereum/grid-ui,grid-ui,"UI for Ethereum Grid, written in React",JavaScript,Others,ethereum
https://api.github.com/repos/rkalis/ethroulette,ethroulette,Decentralised autonomous casino on the Ethereum blockchain,TypeScript,Crypto,ethereum
https://api.github.com/repos/clovers-network/clovers-dapp,clovers-dapp,Ethereum Artwork NFTokens Minted by Proof-of-Search Mining,Vue,Crypto,ethereum
https://api.github.com/repos/thorie7912/bitcoin-calculator,bitcoin-calculator,,,Crypto,bitcoin
https://api.github.com/repos/hussy-io/truffle-ledger-provider,truffle-ledger-provider,Ledger Wallet-enabled Web3 provider,,Crypto,ethereum
https://api.github.com/repos/KoinEx/pulse,pulse,EOS Chrome Extension,JavaScript,Crypto,multi
https://api.github.com/repos/ETCLabs/LuminosusEosEdition,LuminosusEosEdition,Unofficial Eos Companion App,C++,Others,eos
https://api.github.com/repos/lky1001/every-eos,every-eos,Decentralized exchange based on eos.io,,Crypto,eos
https://api.github.com/repos/GBKS/monero-wallet-design,monero-wallet-design,UI design proposal for the official wallet for the Monero cryptocurrency. ,,Crypto,monero
https://api.github.com/repos/mosendo/gasless,gasless,Send DAI without ETH in your wallet,Vue,Crypto,multi
https://api.github.com/repos/StarryJapanNight/eosnameswaps,eosnameswaps,A decentralized EOS account exchange.,,Crypto,eos
https://api.github.com/repos/cryptoapi/Bitcoin-Gateway-Paid-Memberships-Pro,Bitcoin-Gateway-Paid-Memberships-Pro,"Provides a Bitcoin/Altcoins Payment Gateway for Paid Memberships Pro 1.8+. Direct Integration on your website, no external payment pages opens. Accept Bitcoin, Litecoin, Dogecoin, Paycoin, Reddcoin, Speedcoin, Darkcoin, Potcoin, Feathercoin, Vertcoin, Ver",PHP,Crypto,multi
https://api.github.com/repos/arcbtc/M5StackSats,M5StackSats,A bitcoin point of sale terminal using the ESP32 based M5Stack,C,Crypto,multi
https://api.github.com/repos/adityapk00/zecwallet-lite,zecwallet-lite,Zecwallet-Lite is z-Addr first lightwallet for Zcash. ,C++,Crypto,zcash
https://api.github.com/repos/Rapprise/b2s-trader,b2s-trader,Application to automate trading process,C++,Crypto,bitcoin
https://api.github.com/repos/Kamahl19/react-native-wallet,react-native-wallet,Simple mobile Bitcoin & Ethereum wallet,JavaScript,Crypto,multi
https://api.github.com/repos/kendricktan/generalized-aave-flashloans,generalized-aave-flashloans,Generalized Aave Flashloans,JavaScript,Crypto,aave
https://api.github.com/repos/MoonWanki/the-great-venus,the-great-venus,The Great Venus (2018),JavaScript,Others,ethereum
https://api.github.com/repos/wibxcoin/Contracts,Contracts,All WiBX blockchain chain code,JavaScript,Crypto,multi
https://api.github.com/repos/alessandrokonrad/BitView,BitView,"A crypto portfolio written in Flutter. It supports Binance, Bittrex, Coinbase, Coinbase Pro and Mercatox",Makefile,Crypto,binance
https://api.github.com/repos/sreyafrancis/BlockchainForFederatedLearning,BlockchainForFederatedLearning,"Democratize access to data, decentralize Artificial intelligence and enhance user privacy with Federated learning and Blockchain.",Python,Others,multi
https://api.github.com/repos/snjax/zDai-mixer,zDai-mixer,,JavaScript,Crypto,dai
https://api.github.com/repos/amazingandyyy/etherbrite,etherbrite,An eventbrite-like project on ethereum blockchain. A full-stack Dapp built with Solidity and Web3js.,JavaScript,Others,ethereum
https://api.github.com/repos/SCBuergel/timeLock-smartContract,timeLock-smartContract,smart contract on Ethereum to lock funds for a user-defined period of time,,Others,ethereum
https://api.github.com/repos/BlocknetDX/blockdx-ui,blockdx-ui,BLOCK DX p2p exchange dapp,JavaScript,Crypto,others
https://api.github.com/repos/remyers/txtenna-python,txtenna-python,Python based version of txtenna that can send and receive Bitcoin transactions via a local txtenna-server,,Crypto,bitcoin
https://api.github.com/repos/MatterPool/TXQ,TXQ,TXQ: Bitcoin Transaction Queue Storage,TypeScript,Crypto,bitcoin
https://api.github.com/repos/input-output-hk/cardano-ledger-specs,cardano-ledger-specs,A formal specification and executable model of the ledger rules introduced by the Shelley release,TeX,Crypto,cardano
https://api.github.com/repos/Privatix/dappctrl,dappctrl,Back-end application with core functionality for Privatix DApp,Go,Others,others
https://api.github.com/repos/CryptoDevTV/SolBo,SolBo,Yet another simple trading bot,,Crypto,others
https://api.github.com/repos/jin10086/eos-bonus-getting,eos-bonus-getting,,Python,Others,eos
https://api.github.com/repos/iearn-finance/itoken,itoken,iToken wrappers for automated investment strategy tokenization,JavaScript,Crypto,ethereum
https://api.github.com/repos/WietseWind/xrpayments.co,xrpayments.co,In-store payment requests in XRP (using Ripple URI QR) - With currency converter,,Crypto,multi
https://api.github.com/repos/orange-org/orange,orange,TypeScript and Electron based UI for Bitcoin Core,,Others,bitcoin
https://api.github.com/repos/OpenST/mosaic-contracts,mosaic-contracts,Mosaic is a set of meta-blockchains on top of Ethereum to scale DApps,JavaScript,Others,ethereum
https://api.github.com/repos/linkpoolio/asset-price-cl-ea,asset-price-cl-ea,External Adaptor for Chainlink which aggregates prices of crypto assets from multiple exchanges.,,Crypto,chainlink
https://api.github.com/repos/chainx-org/polkadot-white-paper-cn,polkadot-white-paper-cn,polkadot 白皮书中文译本,,Others,polkadot
https://api.github.com/repos/MediShares/mds-eosjs,mds-eosjs,EOS jQuery plugin for Math Wallet APP,,Crypto,eos
https://api.github.com/repos/orangeflame/binance-fe-test,binance-fe-test,,,Others,binance
https://api.github.com/repos/xilibi2003/DAppDemos,DAppDemos,,,Others,ethereum
https://api.github.com/repos/ethereum/benchmarking,benchmarking,Benchmarking data for EVM ops and precompiles,,Others,ethereum
https://api.github.com/repos/skarlekar/smart-quora,smart-quora,A Quora-like app powered by Blockchain,,Others,others
https://api.github.com/repos/blockfirm/utxo-stats.com,utxo-stats.com,Visualizes the distribution of the unspent transaction outputs (UTXO) in the Bitcoin Blockchain.,JavaScript,Crypto,bitcoin
https://api.github.com/repos/Councilbox/cbx-quorum-explorer,cbx-quorum-explorer,The open source block explorer for Quorum-based blockchains ⛓️,JavaScript,Others,quorum
https://api.github.com/repos/uPlexa/uplexa,uplexa,uPlexa: Incentivizing the mass compute power of IoT devices to form a means of anonymous blockchain payments.,C++,Crypto,others
https://api.github.com/repos/Synthetixio/synthetix-js,synthetix-js,Stablecoin payments for your JavaScript crypto dApps,JavaScript,Crypto,multi
https://api.github.com/repos/steven2358/BitcoinSneakPeek,BitcoinSneakPeek,Chrome extension to instantly see the balance of any Bitcoin address.,JavaScript,Crypto,bitcoin
https://api.github.com/repos/martinlsanchez/daiauctions,daiauctions,MakerDao Dai Auctions,JavaScript,Crypto,multi
https://api.github.com/repos/Keydonix/uniswap-oracle,uniswap-oracle,A general purpose price feed oracle built on Uniswap v2 that supports arbitrary time windows and donations for funding.,TypeScript,Crypto,uniswap
https://api.github.com/repos/arcbtc/1.21,1.21,"A cheap to run/make bitcoin lightning-network slave module (uses an ESP32 + Waveshare 1,54"" epaper to receive LN payments of a fixed amount, then sends an on to a GPIO)",,Crypto,multi
https://api.github.com/repos/Kaisle/await-transaction-mined,await-transaction-mined,Check whether an Ethereum transaction has been mined.,,Crypto,ethereum
https://api.github.com/repos/SevenEX/bitrade-parent,bitrade-parent,"digital exchange, bitcoin exchange, 交易所, 数字货币交易所",Java,Crypto,bitcoin
https://api.github.com/repos/eoshubio/eoshub-ios,eoshub-ios,The safest EOS mobile wallet for iOS,,Crypto,eos
https://api.github.com/repos/gatewaycash/gateway,gateway,Gateway - Simple Bitcoin Payments,JavaScript,Crypto,bitcoin
https://api.github.com/repos/joshbressers/blockchain-elasticsearch,blockchain-elasticsearch,Project for putting Blockchain data into Elasticsearch,Python,Others,bitcoin
https://api.github.com/repos/brewaa/stellar-checkout,stellar-checkout,,JavaScript,Crypto,stellar
https://api.github.com/repos/studydefi/dedge,dedge,,TypeScript,Crypto,ethereum
https://api.github.com/repos/bitcoin-portal/bitcoin-wallet-releases,bitcoin-wallet-releases,,,Crypto,bitcoin
https://api.github.com/repos/C3Pool/profit-switching-miner,profit-switching-miner,"Cryptonight Profit Switching Pool, Monero(XMR) Payout.",,Crypto,monero
https://api.github.com/repos/cyber-drop/ethereum_analytical_db,ethereum_analytical_db,Ethereum data access solution that can be used for analytics and application development. The solution works on a fast DB - Clickhouse.,,Others,ethereum
https://api.github.com/repos/brunobar79/react-native-web3-webview,react-native-web3-webview,A react native webview optimized for a web3 browser application,Java,Others,ethereum
https://api.github.com/repos/dfinityexplorer/dfinityexplorer,dfinityexplorer, DFINITY Explorer is an open-source block explorer for the DFINITY blockchain.,,Others,others
https://api.github.com/repos/GoodDollar/GoodDAPP,GoodDAPP,,,Crypto,ethereum
https://api.github.com/repos/IBM/hyperledger-fabric-evm-demo,hyperledger-fabric-evm-demo,hyperledger-fabric-evm-demo,,Others,multi
