url,name,description,language,Category,blockchain
https://api.github.com/repos/tycooperaow/ipfstagram,ipfstagram,A blockchain powered verison of instagram,JavaScript,Others,others
https://api.github.com/repos/iwaldman/ipfs-image-dapp,ipfs-image-dapp,A Decentralized Application (dApp) with React that demonstrates how to implement IPFS file uploads and store the IPFS hash in an Ethereum smart contract.,JavaScript,Others,ethereum
https://api.github.com/repos/filipmartinsson/Solidity,Solidity,,,Others,ethereum
https://api.github.com/repos/AnttheAdventurer/market_maker,market_maker,market making algo for CBpro and Binance,Python,Crypto,binance
https://api.github.com/repos/crossclaim/xclaim-sol,xclaim-sol,"XCLAIM(BTC,ETH): Solidity implementation for Bitcoin backed tokens on Ethereum",JavaScript,Crypto,multi
https://api.github.com/repos/vue-polkadot/apps,apps,Vue apps for vue-polkadot dashboard,Vue,Others,polkadot
https://api.github.com/repos/stellar/stellar_core_commander,stellar_core_commander,A system of creating isolated Stellar test networks into which you can play transactions and record results.,Ruby,Crypto,stellar
https://api.github.com/repos/makerdao/simple-arbitrage-keeper,simple-arbitrage-keeper,Arbitrage Keeper on OasisDEX and Uniswap ,Python,Crypto,uniswap
https://api.github.com/repos/blockmason/web3-provider-ledger,web3-provider-ledger,A web3 provider for Ledger hardware wallets,,Crypto,ethereum
https://api.github.com/repos/dharma-eng/dai-backstop-syndicate,dai-backstop-syndicate,"A pooled liquidity contract for participating in the upcoming MKR auction at a ""backstop"" price of 1 MKR per 100 Dai.",TypeScript,Crypto,dai
https://api.github.com/repos/OpenBazaar/go-ethwallet,go-ethwallet,Ethereum wallet used in OpenBazaar,,Crypto,ethereum
https://api.github.com/repos/flightwallet/decode-eth-tx,decode-eth-tx,Simple viewer for ethereum raw transaction,JavaScript,Others,ethereum
https://api.github.com/repos/1iveowl/CosmosResourceTokenBroker,CosmosResourceTokenBroker,,C#,Crypto,cosmos
https://api.github.com/repos/Preetam007/hyperledger_composer_file_storage,hyperledger_composer_file_storage,Hyperledger composer file/pdf/document storage,,Others,hyperledger fabric
https://api.github.com/repos/Ziggoto/voting-dapp-sample,voting-dapp-sample,A simple simple of a voting dapp using Ethereum's blockchain,,Others,ethereum
https://api.github.com/repos/Coldcard/ckbunker,ckbunker,CKBunker - A Bitcoin HSM solution to securely authorize transactions using an online Coldcard (over Tor),JavaScript,Others,bitcoin
https://api.github.com/repos/eddieoz/truffle-mercado-pokemon,truffle-mercado-pokemon,Exemplo didático de smart-contracts Ethereum utilizando truffle.,,Others,ethereum
https://api.github.com/repos/irisnet/explorer,explorer,Blockchain explorer for the IRIS network,Go,Others,others
https://api.github.com/repos/coreyphillips/moonshine,moonshine,"Moonshine is a homebrewed, open-source, non-custodial, Bitcoin/Litecoin Electrum wallet for iOS & Android.",JavaScript,Crypto,multi
https://api.github.com/repos/AlphaWallet/blockchain-attestation,blockchain-attestation,Paper and implementation of blockchain attestations,TeX,Others,ethereum
https://api.github.com/repos/CryptoLions/EOS-Claim-Bot,EOS-Claim-Bot,claim rewards bot + Telegram and log report,,Others,eos
https://api.github.com/repos/Coware-Apps/ellenorzo,ellenorzo,Arisztokréta: Nem hivatalos KRÉTA-kompatibilis ellenőrző alkalmazás,,Others,multi
https://api.github.com/repos/shawntabrizi/ETH-Transaction-Graph,ETH-Transaction-Graph,Dynamic graph or Ethereum transactions using Web3.js subscribe,JavaScript,Others,ethereum
https://api.github.com/repos/mrdavey/CollateralSwapFrontend,CollateralSwapFrontend,Frontend for my latest Solidity ethereum experiment dealing with collateral swaps with an atomic transaction.,JavaScript,Others,ethereum
https://api.github.com/repos/openeth-dev/gsn,gsn,GSN - Ethereum Gas Station Network,JavaScript,Others,ethereum
https://api.github.com/repos/DrrMrr/qt-bitcoin-trader-scripts,qt-bitcoin-trader-scripts,,,Crypto,bitcoin
https://api.github.com/repos/HydroProtocol/ethereum-watcher,ethereum-watcher,make getting updates from blockchain easier,Go,Others,ethereum
https://api.github.com/repos/fuseio/fuse-wallet,fuse-wallet,Cross platform mobile Ethereum wallet based on Flutter,Dart,Crypto,ethereum
https://api.github.com/repos/Volentix/EZEOS,EZEOS,"Simple UI for test purposes to create EOS wallets, issue tokens, and transfer EOS between wallets",Python,Crypto,eos
https://api.github.com/repos/luxtagofficial/Apostille-library,Apostille-library,"A novel & holistic blockchain notarization and timestamping with transferable, updatable, branded, and conjointly owned notarizations.",TypeScript,Others,nem
https://api.github.com/repos/thetatoken/theta-infrastructure-vault,theta-infrastructure-vault,Reference implementation of the server side Theta wallet,Go,Crypto,theta
https://api.github.com/repos/mosendo/gasless.js,gasless.js,Gasless Dai transfers for browser & Node.js,HTML,Others,dai
https://api.github.com/repos/Novusphere/eos-forum,eos-forum,An experimental Reddit-style forum built on EOS by the Novusphere community,Vue,Others,eos
https://api.github.com/repos/primitivefinance/primitive-contracts,primitive-contracts,Alpha Primitive Solidity Contracts :warning:,JavaScript,Others,ethereum
https://api.github.com/repos/input-output-hk/cardano-sl-explorer,cardano-sl-explorer,,,Others,cardano
https://api.github.com/repos/edmlbox/GethDesk,GethDesk,"GethDesk - is a web based application to simplify work with Ethereum ""Geth Go"" console client.",,Others,ethereum
https://api.github.com/repos/jamesgeorge007/Crypto-App,Crypto-App,This is a Desktop application built in Electron JS which notifies the user whenever value of Bitcoin goes above a certain value specified by the user in USD.,JavaScript,Crypto,bitcoin
https://api.github.com/repos/ZencashOfficial/zenchat,zenchat,"Private and Anonymous Messaging Application, built on top of the Zencash blockchain",,Others,others
https://api.github.com/repos/status-im/ens-usernames,ens-usernames,,,Others,ethereum
https://api.github.com/repos/artyomLisovskij/solidity-erc20-token-bootstrap,solidity-erc20-token-bootstrap,This is basic ERC20 ethereum token source code.,,Crypto,ethereum
https://api.github.com/repos/Parity-JS/dapp-wallet,dapp-wallet,,,Crypto,ethereum
https://api.github.com/repos/exonum/blockchain-explorer,blockchain-explorer,An explorer for Exonum blockchains,JavaScript,Others,others
https://api.github.com/repos/Conicoin/ethereum-wallet,ethereum-wallet,Native Ethereum Wallet - iOS,C,Crypto,ethereum
https://api.github.com/repos/yekai1003/WeWallet,WeWallet,ethereum token wallet,,Crypto,ethereum
https://api.github.com/repos/pxsocs/thewarden,thewarden,Open Source Portfolio Tracker for Bitcoin,Python,Others,bitcoin
https://api.github.com/repos/DAO-IPCI/DAO-IPCI,DAO-IPCI,"Decentralized autonomous organization «The Integrated Program for Climate Initiatives». DApp,  smart contracts and blockchain technology-based ledger for carbon units and carbon units’ operations data.",JavaScript,Others,ethereum
https://api.github.com/repos/SiliconJungles/onepiece-dapp,onepiece-dapp,A simple dapp written by Scilla - Running on Zilliqa ,JavaScript,Others,zilliqa
https://api.github.com/repos/MLH/mlh-localhost-icon-blockchain-casino,mlh-localhost-icon-blockchain-casino,,Python,Others,icon
https://api.github.com/repos/justinschuldt/out-front,out-front,a web3 app,TypeScript,Others,ethereum
https://api.github.com/repos/Savjee/savjeecoin-frontend,savjeecoin-frontend,,TypeScript,Others,others
https://api.github.com/repos/iotaledger/data-marketplace,data-marketplace,Proof of Concept Data Marketplace built using MAM and IOTA Tangle.,JavaScript,Others,iota
https://api.github.com/repos/OpenZesame/Zhip,Zhip,iOS Wallet for Zilliqa,Swift,Crypto,zilliqa
https://api.github.com/repos/hsjoberg/blixt-wallet,blixt-wallet,Bitcoin Lightning Wallet with focus on usability and user experience,TypeScript,Crypto,bitcoin
https://api.github.com/repos/lky1001/tron-android-wallet,tron-android-wallet,Tron wallet for android,,Crypto,tron
https://api.github.com/repos/ibm-watson-iot/iota-starter-obd-android,iota-starter-obd-android,Android application demonstrating use of OBD2 device with IoT for Automotive Starter Fleet Management,,Others,iota
https://api.github.com/repos/austintgriffith/galleass,galleass,Ethereum game based in the age of sail.,JavaScript,Others,ethereum
https://api.github.com/repos/jonathanrjpereira/Bitcoin-Bar,Bitcoin-Bar,Physical Bitcoin Notification,,Others,bitcoin
https://api.github.com/repos/jibrelnetwork/jibrel-contracts,jibrel-contracts,Ethereum smart contracts to support the on-chain activity of the Jibrel,JavaScript,Others,ethereum
https://api.github.com/repos/WietseWind/xrp-vanity-generator,xrp-vanity-generator,Generate XRP Vanity Addresses (Wallets) on your local computer,,Crypto,xrp
https://api.github.com/repos/zcash-community/zcash-full-node-wallet,zcash-full-node-wallet,,Java,Crypto,zcash
https://api.github.com/repos/bitauth/bitauth,bitauth,"A universal identity and authentication protocol, based on bitcoin",TypeScript,Others,bitcoin
https://api.github.com/repos/tagphi/dif-client,dif-client,Distributed Invalid Traffic Filter Powered by Hyperledger Fabric,,Others,hyperledger fabric
https://api.github.com/repos/gettyio/tron-vault,tron-vault,A digital identity cold wallet for TRON,JavaScript,Crypto,tron
https://api.github.com/repos/Fragmented-World/fragmented-web-ui,fragmented-web-ui,A decentralized social network for Ethereum enthusiasts.,,Others,ethereum
https://api.github.com/repos/gnosis/mock-contract,mock-contract,Simple Solidity contract to mock dependent contracts in truffle tests.,JavaScript,Others,ethereum
https://api.github.com/repos/ferencberes/ethereum-privacy,ethereum-privacy,Profiling and Deanonymizing Ethereum Users,Python,Others,ethereum
https://api.github.com/repos/PACTCare/Chiota,Chiota,Your IOTA Chat App,C#,Others,iota
https://api.github.com/repos/Rishabh42/HealthCare-Insurance-Ethereum,HealthCare-Insurance-Ethereum,An Insurance claiming DApp which uses Multi-Sigs to grant claim.,JavaScript,Others,ethereum
https://api.github.com/repos/One-Click-Dapp/one-click-dApp,one-click-dApp,:zap::wrench::link: :shipit: Instantly build a dApp with a simple URL to bookmark or share with a friend.,JavaScript,Others,ethereum
https://api.github.com/repos/IBM/Blockchain-for-maintaining-Digital-Assets,Blockchain-for-maintaining-Digital-Assets,,JavaScript,Others,hyperledger fabric
https://api.github.com/repos/asc-lab/blockchain-multichain,blockchain-multichain,Application for proposals using blockchain with MultiChain.,,Others,others
https://api.github.com/repos/IBM/blockchain-enabled-crowdfunding,blockchain-enabled-crowdfunding,Demonstrate the use of Hyperledger Fabric for building a collaboration platform for Crowdfunding,Java,Others,hyperledger fabric
https://api.github.com/repos/Bearle/django-scatter-auth,django-scatter-auth,Django Scatter Auth for EOS blockchain,Python,Others,eos
https://api.github.com/repos/zulurepublic/liteIM,liteIM,A full-featured conversational Litecoin wallet,JavaScript,Crypto,litecoin
https://api.github.com/repos/filecoin-project/filecoin-explorer,filecoin-explorer,Filecoin block explorer,JavaScript,Others,filecoin
https://api.github.com/repos/kevinejohn/bsv-p2p,bsv-p2p,Communicate on the Bitcoin P2P network,JavaScript,Others,bitcoin
https://api.github.com/repos/ConsenSys/panvala,panvala,Make Ethereum safer,TypeScript,Others,ethereum
https://api.github.com/repos/scottrepreneur/pool-together,pool-together,a no-lose lottery with Dai built on Ethereum,JavaScript,Crypto,multi
https://api.github.com/repos/nschapeler/Ethereum-Android-Intro,Ethereum-Android-Intro,,Java,Others,ethereum
https://api.github.com/repos/IBM/SecuringArt-using-Blockchain-DigitalCertificates,SecuringArt-using-Blockchain-DigitalCertificates,Auction application where users register artwork and secure through digital certification on the chain,,Others,hyperledger fabric
https://api.github.com/repos/argentlabs/hopper,hopper,Hopper: an Open-Source Mixer for Mobile-friendly private transfers on Ethereum,C++,Others,ethereum
https://api.github.com/repos/octo-technology/tezos-academy,tezos-academy,Open-source code of Tezos Academy,TypeScript,Others,tezos
https://api.github.com/repos/lhalcyon/l_token,l_token,A Flutter Ethereum Wallet Project,,Crypto,ethereum
https://api.github.com/repos/InfiniverseAR/infiniverse-eos,infiniverse-eos,This repository contains the EOS smart contracts that power Infiniverse.,,Others,eos
https://api.github.com/repos/SilentCicero/multisignaturewallet,multisignaturewallet,311 byte EIP712 Signing Compliant Delegate-Call Enabled MultiSignature Wallet for the Ethereum Virtual Machine,,Crypto,ethereum
https://api.github.com/repos/manthanthakker/BitcoinPrediction,BitcoinPrediction,CryptoCurrency prediction using Deep Recurrent Neural Networks,Jupyter Notebook,Crypto,bitcoin
https://api.github.com/repos/OpenMined/Aries-DID,Aries-DID,A repo for exploring the use of Hyperledger Aries to facilitate decentralised identity services.,TypeScript,Others,others
https://api.github.com/repos/OpenMined/aries-fl,aries-fl,Federated Learning on HyperLedger Aries,Python,Others,others
https://api.github.com/repos/brndnhrbrt/ln-donate-node,ln-donate-node,A set-and-forget Bitcoin Lightning Network invoice generator,JavaScript,Others,bitcoin
https://api.github.com/repos/YaleOpenLab/opensolar,opensolar,Open source platform to finance solar systems through blockchain and IoT based smart contracts,,Others,stellar
https://api.github.com/repos/KZen-networks/binance-thresh-wallet,binance-thresh-wallet,Wallet for Binance chain powered by two-party ECDSA,,Crypto,binance
https://api.github.com/repos/ShipChain/engine,engine,An RPC server that exposes a Typescript abstraction layer on top of the Web3 bindings for ShipChain's Ethereum smart contracts.,,Others,ethereum
https://api.github.com/repos/baking-bad/better-call-dev,better-call-dev,Smart contract explorer for Tezos,,Others,tezos
https://api.github.com/repos/amandris/arbitrage-trading-bot,arbitrage-trading-bot,Bot to automate trading orders between Bitcoin exchanges to make some profit.,CSS,Crypto,bitcoin
https://api.github.com/repos/Alethio/ethstats-network-server,ethstats-network-server,,,Others,ethereum
https://api.github.com/repos/londonappbrewery/bitcoin-ticker-flutter,bitcoin-ticker-flutter,,Dart,Others,bitcoin
https://api.github.com/repos/WietseWind/xrp-text,xrp-text,Exchange XRP using Text Messages,,Crypto,xrp
https://api.github.com/repos/monerium/smart-contracts,smart-contracts,Smart contracts deployed on Ethereum,JavaScript,Others,ethereum
https://api.github.com/repos/btcven/locha-mesh-chat,locha-mesh-chat,Chat and send Bitcoin without internet connection.,JavaScript,Crypto,bitcoin
https://api.github.com/repos/stealthyim/mobile,mobile,"Pending: iOS & Android app with dApp integrations, e2e chat, notifications, discovery, etc",,Others,others
https://api.github.com/repos/arms22/mexbots,mexbots,Bitcoin Trading Bot for BitMEX,,Crypto,bitcoin
https://api.github.com/repos/sparkswap/sparkswap-desktop,sparkswap-desktop,Buy Bitcoin instantly on the Lightning Network,TypeScript,Crypto,bitcoin
https://api.github.com/repos/flufy3d/MetaID,MetaID,a chrome extension for bitcoin sv wallet ,,Crypto,bitcoin sv
https://api.github.com/repos/julianYaman/bitcoin-clicker,bitcoin-clicker,,JavaScript,Others,bitcoin
https://api.github.com/repos/ramyhardan/proof-of-existence,proof-of-existence,Ethereum Smart Contract to prove a document's existence at some point by storing and verifying its hash.,,Others,ethereum
https://api.github.com/repos/jogendra/OpenTender,OpenTender,Application for make government tender process transparent using Hyperledger (Blockchain) technology.,,Others,hyperledger fabric
https://api.github.com/repos/anuragrana/bitcoin-prices-in-python-django,bitcoin-prices-in-python-django,Python-Django project to show bitcoin and other crypto-currencies latest price.,,Crypto,multi
https://api.github.com/repos/keep-network/tbtc-dapp,tbtc-dapp,tBTC dApp,JavaScript,Others,ethereum
https://api.github.com/repos/openworklabs/filecoin-web-wallet,filecoin-web-wallet,An experimental UNSAFE web wallet that allows users to transfer faucet Filecoin,JavaScript,Crypto,filecoin
https://api.github.com/repos/ETCDEVTeam/emerald-rs,emerald-rs,Secure account management for Ethereum Classic,Rust,Others,ethereum classic
https://api.github.com/repos/pramodramdas/digital_healthcare,digital_healthcare,electronic health records on blockchain,,Others,ethereum
https://api.github.com/repos/synfonaut/powmarket,powmarket,A distributed computation market for magic numbers on Bitcoin,JavaScript,Others,bitcoin
https://api.github.com/repos/freeatnet/web3-react-simple-app,web3-react-simple-app,A simple app to get started with web3-react (https://github.com/NoahZinsmeister/web3-react),TypeScript,Others,ethereum
https://api.github.com/repos/The-Studio-io/xDAI-Discord-bot,xDAI-Discord-bot,Repo for an xDAI Discord bot,,Others,dai
https://api.github.com/repos/Angelfire/crypto-visor,crypto-visor,???? Cryptocurrencies visor ,JavaScript,Others,multi
https://api.github.com/repos/mapachurro/OpenLease,OpenLease,"A mobile-focused platform, written in Scala, to leverage the capabilities of OpenLaw's smart contracts and offer the ability to execute a real estate lease on the blockchain.",Shell,Others,ethereum
https://api.github.com/repos/dappforce/dappforce-substrate-multisig,dappforce-substrate-multisig,Experimental multisig wallet module with web UI for Substrate/Polkadot blockchains.,TypeScript,Crypto,polkadot
https://api.github.com/repos/jestevez/ethereum-java-wallet,ethereum-java-wallet,Un ejemplo de monedero escrito en Java usando Web3j,,Crypto,ethereum
https://api.github.com/repos/IBM/ngo-collaboration-using-blockchain,ngo-collaboration-using-blockchain,Demonstrate the use of Hyperledger Fabric for building a collaboration platform for NGOs.,,Others,hyperledger fabric
https://api.github.com/repos/QuantaPay/qwallet,qwallet,Blockchain Wallet for Ethereum and ERC20 Tokens,,Crypto,ethereum
https://api.github.com/repos/moosylog/exchange_collectors,exchange_collectors,Google Apps Script GAS | bittrex bitfinex bitmex binance huobi poloniex | Google Sheets | Javascript,JavaScript,Crypto,binance
https://api.github.com/repos/btspp/bitshares-mobile-app,bitshares-mobile-app,This is the mobile app for bitshares blockchain,,Others,others
https://api.github.com/repos/ChingStore/ching,ching,POS that accepts DAI!,JavaScript,Others,dai
https://api.github.com/repos/TezosRio/taps,taps,TAPS - Tezos Automatic Payment System,ColdFusion,Crypto,tezos
https://api.github.com/repos/unwriter/BitcoinMediaUpload,BitcoinMediaUpload,A set of demos to demonstrate how to upload media to Bitcoin using Datapay or Bitpipe,JavaScript,Others,bitcoin
https://api.github.com/repos/input-output-hk/symphony-2,symphony-2,Immersive 3D Blockchain Explorer,JavaScript,Others,others
https://api.github.com/repos/virgo-project/dither,dither,"Transparent, uncensorable chat on the Cosmos Hub.",Vue,Others,cosmos
https://api.github.com/repos/Dapp-Wizards/Avastars-Contracts,Avastars-Contracts,Ethereum contracts and unit tests for Avastars project,Solidity,Others,ethereum
https://api.github.com/repos/ethereum-alarm-clock/cli,cli,The EAC swiss army knife. > npm i -g @ethereum-alarm-clock/cli,JavaScript,Others,ethereum
https://api.github.com/repos/Dapp-rosetta/dapp-rosetta-contract,dapp-rosetta-contract,,C++,Others,ethereum
https://api.github.com/repos/epochchaser/eos-toolbox,eos-toolbox,,,Others,eos
https://api.github.com/repos/piy0999/CreditSense,CreditSense,A decentralised credit scoring platform based on ethereum blockchain,,Others,ethereum
https://api.github.com/repos/jonluo94/blockchain,blockchain,区块链底层技术的研究和尝试，智能合约，DAPP，IPFS，超级账本，联盟链,JavaScript,Others,multi
https://api.github.com/repos/Microsoft/inventory-hub-java-on-azure,inventory-hub-java-on-azure,"Sample Inventory Hub App using Serverless and Event-driven Java - on Azure with Spring Boot, Tomcat, Functions, Event Hub and Cosmos DB",Java,Others,cosmos
https://api.github.com/repos/makerdao/scd-cdp-portal,scd-cdp-portal,Single-Collateral DAI CDP Portal (front-end part),JavaScript,Others,dai
https://api.github.com/repos/EYBlockchain/timber,timber,Construct a Merkle Tree database from Ethereum logs.,JavaScript,Others,ethereum
https://api.github.com/repos/zilpay/zil-pay,zil-pay,The ZilPay browser extension enables browsing Zilliqa blockchain enabled websites.,JavaScript,Crypto,zilliqa
https://api.github.com/repos/future-tense/stellar-nft-issuer,stellar-nft-issuer,,,Crypto,stellar
https://api.github.com/repos/CityOfZion/neo-mon,neo-mon,Neo Network Status Monitor,,Others,neo
https://api.github.com/repos/kaleido-io/kaleido-go,kaleido-go,Ethereum Chain Exerciser from Kaleido,Go,Others,ethereum
https://api.github.com/repos/markspereira/alice,alice,Build native mobile dapps into a crypto wallet,JavaScript,Crypto,ethereum
https://api.github.com/repos/maxwolff/dinoswap,dinoswap,A Uniswap Fork enabling ERC20 to ERC20 trades,JavaScript,Crypto,uniswap
https://api.github.com/repos/SecurityInnovation/Smart-Contract-CTF,Smart-Contract-CTF,A Blockchain And Smart Contract Based CTF,,Others,ethereum
https://api.github.com/repos/tjcsl/director,director,Director (web3),JavaScript,Others,others
https://api.github.com/repos/binance-chain/ledger-app-binance,ledger-app-binance,application that enables Ledger hardware wallet to support Binance Chain.,C,Crypto,binance
https://api.github.com/repos/dashed-slug/wallets,wallets,"Bitcoin and Altcoin Wallets FREE WordPress Plugin: Turn your blog into a bank: Let your users deposit, withdraw, and transfer bitcoins and altcoins on your site.",,Crypto,bitcoin
https://api.github.com/repos/near/near-explorer,near-explorer,NEAR blockchain explorer,TypeScript,Others,others
https://api.github.com/repos/IBM/Using-IOT-toProcess-BlockchainAnalytics,Using-IOT-toProcess-BlockchainAnalytics,,,Others,hyperledger fabric
https://api.github.com/repos/enarjord/passivbot,passivbot,trading bot running on binance margin,Python,Crypto,binance
https://api.github.com/repos/mataide/serverless-hyperledger,serverless-hyperledger,Serverless Hyperledger,,Others,hyperledger fabric
https://api.github.com/repos/NHibiki/evtscan,evtscan,everiToken BlockChain Explorer,Vue,Others,others
https://api.github.com/repos/MichiKuhl/iota_ros_pkg,iota_ros_pkg,Implementation of IOTA in the Robot Operating System,,Others,iota
https://api.github.com/repos/BlockIo/gem-block-io,gem-block-io,"The easiest way to create, and use, Bitcoin, Dogecoin, and Litecoin wallets for payments as everyday users, and merchants.",Ruby,Crypto,multi
https://api.github.com/repos/stellar/ticker-py,ticker-py,ticker info for the stellar decentralized exchange,Python,Crypto,stellar
https://api.github.com/repos/OpenChain-Project/Online-Self-Certification-Web-App,Online-Self-Certification-Web-App,This is the source code for the OpenChain Project Conformance Online Self-Certification Web App,Java,Others,openchain
https://api.github.com/repos/lacchain/DAVID19-taskforce,DAVID19-taskforce,LACChain taskforce to work on the development of a blockchain based app to notarize information about the COVID-19.,JavaScript,Others,ethereum
https://api.github.com/repos/ensdomains/ens-manager,ens-manager,,JavaScript,Others,ethereum
https://api.github.com/repos/nopara73/Dumplings,Dumplings,A cross platform and open source software to create reproducible CoinJoin statistics from Blockchain data.,C#,Others,bitcoin
https://api.github.com/repos/shreyasnbhat/federated-learning,federated-learning,A distributed fedrated learning system on the blockchain.,Python,Others,ethereum
https://api.github.com/repos/status-im/account-contracts,account-contracts,"Key managers, recovery, gas abstraction and self-sovereign identity for web3 universal login.",Solidity,Others,ethereum
https://api.github.com/repos/BitcoinUnlimited/BitcoinUnlimitedWeb,BitcoinUnlimitedWeb,,JavaScript,Others,bitcoin
https://api.github.com/repos/paritytech/polkadash,polkadash,Polkadot Dashboard,,Others,polkadot
https://api.github.com/repos/asheliao/BitcoinCrawler,BitcoinCrawler,Bitcoin Crawler and Notification with Python 3.6,,Others,bitcoin
https://api.github.com/repos/renproject/darknode-sol,darknode-sol," An implementation of Republic Protocol smart contracts, written in Solidity ",TypeScript,Others,ethereum
https://api.github.com/repos/SnaxFoundation/snax,snax,Snax - blockchain-based social overlay with dApps,C++,Others,ethereum
https://api.github.com/repos/ph4r05/monero-trezor-doc,monero-trezor-doc,Monero wallet Trezor integration documentation,,Crypto,monero
https://api.github.com/repos/antb123/stcli,stcli,stcli .py- a repl command line crypto wallet for stellar that is simple and all in one file,,Crypto,stellar
https://api.github.com/repos/robsecord/gatsby-eth-dapp-starter,gatsby-eth-dapp-starter,Gatsby v2 Starter for Ethereum Dapps using Web3 with various Account Management options,JavaScript,Others,ethereum
https://api.github.com/repos/M-D-Br/FlaskBitcoinDashboard,FlaskBitcoinDashboard,Python Flask Dashboard for watching a Bitcoin node.,JavaScript,Others,bitcoin
https://api.github.com/repos/recoded-co/coinmap,coinmap,Map showing places where Bitcoin is accepted.,JavaScript,Others,bitcoin
https://api.github.com/repos/mixbytes/solidity,solidity,Generic solidity smart-contracts,,Others,ethereum
https://api.github.com/repos/blockxlabs/aiwa,aiwa,DApp Wallet for AION by BlockX Labs,,Crypto,others
https://api.github.com/repos/aeternity/aepp-base,aepp-base,Identity Manager for the aeternity blockchain,Vue,Others,others
https://api.github.com/repos/elishadrion/tBTC-liquidator,tBTC-liquidator,A tBTC liquidator.,JavaScript,Crypto,ethereum
