url,name,description,language,Category,blockchain
https://api.github.com/repos/askmike/gekko,gekko,A bitcoin trading bot written in node,JavaScript,Crypto,bitcoin
https://api.github.com/repos/butor/blackbird,blackbird,Blackbird Bitcoin Arbitrage: a long/short market-neutral strategy,C++,Crypto,bitcoin
https://api.github.com/repos/MetaMask/metamask-extension,metamask-extension,:globe_with_meridians: :electric_plug: metamask chrome extension,JavaScript,Crypto,ethereum
https://api.github.com/repos/bitcoin-wallet/bitcoin-wallet,bitcoin-wallet,"Bitcoin Wallet app for your Android device. Standalone Bitcoin node, no centralized backend required.",Java,Crypto,bitcoin
https://api.github.com/repos/yasinkuyu/binance-trader,binance-trader,Bitcoin Trading Bot for Binance (Experimental),,Crypto,multi
https://api.github.com/repos/ConsenSys/Tokens,Tokens,Ethereum Token Contracts,JavaScript,Crypto,ethereum
https://api.github.com/repos/TokenMarketNet/ico,ico,Ethereum ICO smart contracts and tools for managing crowdsales,,Crypto,ethereum
https://api.github.com/repos/CryptoSignal/crypto-signal,crypto-signal,"Automated Crypto Trading & Technical Analysis (TA) Bot for Bittrex, Binance, GDAX, and more! (250+ coins)",Python,Crypto,multi
https://api.github.com/repos/sammy007/open-ethereum-pool,open-ethereum-pool,Open Ethereum Mining Pool,Go,Crypto,ethereum
https://api.github.com/repos/hyperledger/blockchain-explorer,blockchain-explorer,,,Others,multi
https://api.github.com/repos/cubedro/eth-netstats,eth-netstats,Ethereum Network Stats,JavaScript,Others,ethereum
https://api.github.com/repos/zkSNACKs/WalletWasabi,WalletWasabi,"Privacy focused, ZeroLink compliant Bitcoin wallet.",,Crypto,bitcoin
https://api.github.com/repos/bitcoin-abe/bitcoin-abe,bitcoin-abe,Abe: block browser for Bitcoin and similar currencies,Python,Others,multi
https://api.github.com/repos/lefnire/tforce_btc_trader,tforce_btc_trader,TensorForce Bitcoin Trading Bot,Python,Crypto,bitcoin
https://api.github.com/repos/aragon/aragon,aragon,Aragon dapp to create and manage blockchain companies.,,Others,ethereum
https://api.github.com/repos/blockchain/service-my-wallet-v3,service-my-wallet-v3,Blockchain Wallet API V2,JavaScript,Crypto,others
https://api.github.com/repos/btcsuite/btcwallet,btcwallet,A secure bitcoin wallet daemon written in Go (golang),Go,Crypto,bitcoin
https://api.github.com/repos/OutCast3k/coinbin,coinbin,"Javascript Bitcoin Wallet. Supports Multisig, Stealth, HD, Time Locked Addresses and more!",JavaScript,Crypto,bitcoin
https://api.github.com/repos/ethereum/meteor-dapp-wallet,meteor-dapp-wallet,,JavaScript,Crypto,ethereum
https://api.github.com/repos/raineorshine/solgraph,solgraph,Visualize Solidity control flow. Convert .sol -> .dot,JavaScript,Others,ethereum
https://api.github.com/repos/poanetwork/blockscout,blockscout,A tool for inspecting and analyzing EVM based blockchains. Blockchain explorer for Ethereum networks.,Elixir,Others,ethereum
https://api.github.com/repos/Sparklemobile/Sparkle-Proof-Of-Loyalty,Sparkle-Proof-Of-Loyalty,Sparkle Proof of Loyalty Contract - Truffle ,JavaScript,Others,ethereum
https://api.github.com/repos/gurnec/btcrecover,btcrecover,"An open source Bitcoin wallet password and seed recovery tool designed for the case where you already know most of your password/seed, but need assistance in trying different possible combinations.",Python,Others,bitcoin
https://api.github.com/repos/district0x/ethlance,ethlance,Ethlance is the first job market platform built entirely on the Ethereum blockchain. Free to use forever!,Clojure,Others,ethereum
https://api.github.com/repos/IBM/build-blockchain-insurance-app,build-blockchain-insurance-app,,,Others,hyperledger fabric
https://api.github.com/repos/blockchain/thunder,thunder,Off-Chain Bitcoin payments using smart contracts ,Java,Crypto,bitcoin
https://api.github.com/repos/randao/randao,randao,RANDAO: A DAO working as RNG of Ethereum,JavaScript,Others,ethereum
https://api.github.com/repos/square/subzero,subzero,Square's Bitcoin Cold Storage solution.,Java,Others,bitcoin
https://api.github.com/repos/Sparklemobile/Sparkle-Token,Sparkle-Token,Sparkle is a decentralized token created on the Ethereum network.,JavaScript,Crypto,ethereum
https://api.github.com/repos/xiaoyao1991/presto-ethereum,presto-ethereum,,,Others,ethereum
https://api.github.com/repos/LightningNetwork/lightning-onion,lightning-onion,Onion routed micropayments for the Bitcoin Lightning Network,Go,Crypto,bitcoin
https://api.github.com/repos/steemit/condenser,condenser,The social application web front-end to the Steem Blockchain.,JavaScript,Others,others
https://api.github.com/repos/gazbert/bxbot,bxbot,BX-bot (Bex) is a simple Java automated trading bot for trading Bitcoin on cryptocurrency exchanges,Java,Crypto,bitcoin
https://api.github.com/repos/jsappme/node-binance-trader,node-binance-trader,A Cryptocurrency Trading Bot for Binance using Node.JS,,Crypto,binance
https://api.github.com/repos/janoside/btc-rpc-explorer,btc-rpc-explorer,"Stateless Bitcoin blockchain explorer, via RPC. Build with Node.js, express, bootstrap-v4.",,Others,bitcoin
https://api.github.com/repos/breadwallet/breadwallet-ios,breadwallet-ios,The iOS version of the Bread bitcoin wallet.,Swift,Crypto,bitcoin
https://api.github.com/repos/ayeowch/bitnodes,bitnodes,Bitnodes is currently being developed to estimate the size of the Bitcoin network by finding all the reachable nodes in the network ·,Python,Others,bitcoin
https://api.github.com/repos/bither/bither-android,bither-android,Bither - a simple and secure Bitcoin wallet!,Java,Crypto,bitcoin
https://api.github.com/repos/OpenZeppelin/ethernaut,ethernaut,Solidity based wargame,JavaScript,Others,ethereum
https://api.github.com/repos/manuelsc/Lunary-Ethereum-Wallet,Lunary-Ethereum-Wallet,Native Ethereum Wallet for Android,,Crypto,ethereum
https://api.github.com/repos/monero-project/monero-gui,monero-gui,"Monero: the secure, private, untraceable cryptocurrency",QML,Others,monero
https://api.github.com/repos/fravoll/solidity-patterns,solidity-patterns,A compilation of patterns and best practices for the smart contract programming language Solidity I am compiling for my master's thesis.,,Others,ethereum
https://api.github.com/repos/maheshmurthy/ethereum_voting_dapp,ethereum_voting_dapp,Simple Ethereum Voting dapp using Truffle framework,JavaScript,Others,ethereum
https://api.github.com/repos/trufflesuite/truffle-hdwallet-provider,truffle-hdwallet-provider,HD Wallet-enabled Web3 provider,JavaScript,Crypto,ethereum
https://api.github.com/repos/iotaledger/trinity-wallet,trinity-wallet,The IOTA Trinity Wallet - currently in public beta testing,JavaScript,Crypto,iota
https://api.github.com/repos/kelvinau/crypto-arbitrage,crypto-arbitrage,Automatic Trading Bot using Triangular or Exchange Arbitrages,Python,Crypto,multi
https://api.github.com/repos/busyorg/busy,busy,Decentralized social network based on Steem blockchain,JavaScript,Others,others
https://api.github.com/repos/Blockstream/esplora,esplora,Explorer for Bitcoin and Liquid,JavaScript,Others,bitcoin
https://api.github.com/repos/PolymathNetwork/polymath-core,polymath-core,Core Ethereum Smart Contracts for Polymath - The Securities Token Platform,JavaScript,Crypto,ethereum
https://api.github.com/repos/numerai/contract,contract,The Numeraire Ethereum Smart Contract,,Crypto,ethereum
https://api.github.com/repos/TrustWallet/wallet-core,wallet-core,"Cross-platform, cross-blockchain wallet library.",C,Crypto,multi
https://api.github.com/repos/ethers-io/EthersWallet-ios,EthersWallet-ios,Ethereum Wallet and Dapp Browser for iOS.,Objective-C,Crypto,ethereum
https://api.github.com/repos/breadwallet/breadwallet-android,breadwallet-android,android SPV bitcoin wallet,Java,Crypto,bitcoin
https://api.github.com/repos/blockchain-certificates/cert-issuer,cert-issuer,Issues digital certificates using the Bitcoin blockchain,Python,Others,bitcoin
https://api.github.com/repos/MyEtherWallet/ethereum-lists,ethereum-lists,"A repository for maintaining lists of things like malicious URLs, fake token addresses, and so forth. We love lists.",,Others,ethereum
https://api.github.com/repos/MaxLaumeister/bitlisten,BitListen,"Realtime Bitcoin transaction visualizer, written in HTML/Javascript:",JavaScript,Others,bitcoin
https://api.github.com/repos/yuzushioh/EthereumKit,EthereumKit,"BIP32, BIP39 and BIP44 implemented HD wallet for Ethereum",Swift,Crypto,ethereum
https://api.github.com/repos/neo-project/neo-gui,neo-gui,,C#,Others,neo
https://api.github.com/repos/bither/bither-ios,bither-ios,Bither - a simple and secure Bitcoin wallet!,Objective-C,Crypto,bitcoin
https://api.github.com/repos/Giveth/giveth-dapp,giveth-dapp,The giveth dapp MVP,,Others,ethereum
https://api.github.com/repos/409H/EtherAddressLookup,EtherAddressLookup,Adds links to strings that look like Ethereum addresses to etherscan.,,Others,ethereum
https://api.github.com/repos/DingdingKim/CoinNow,CoinNow,"Provide current quotes of coins(BTC, ETH, DASH, LTC, ETC, XRP) in real time from Bithumb and Poloniex.",,Crypto,multi
https://api.github.com/repos/blockchain/blockchain-wallet-v4-frontend,blockchain-wallet-v4-frontend,Pre-release,JavaScript,Crypto,multi
https://api.github.com/repos/mycelium-com/wallet-android,wallet-android,Mycelium Bitcoin Wallet for Android,Java,Crypto,bitcoin
https://api.github.com/repos/truechain/TrueChain-Stellar,TrueChain-Stellar,The front end project of Stellar,Vue,Others,stellar
https://api.github.com/repos/Uniswap/uniswap-frontend,uniswap-frontend,,JavaScript,Others,uniswap
https://api.github.com/repos/polkadot-js/apps,apps,Basic Polkadot/Substrate UI for interacting with a node,JavaScript,Others,polkadot
https://api.github.com/repos/johnathanmartin/piWallet,piWallet,piWallet is a secure opensource online altcoin wallet that works with practically any altcoin including Bitcoin.,PHP,Crypto,multi
https://api.github.com/repos/decred/decrediton,decrediton,Cross platform GUI for decred,,Others,decred
https://api.github.com/repos/xilibi2003/Upchain-wallet,Upchain-wallet,UpChain Wallet - A Powerful & Secure & Open Source Ethereum Android Wallet,Java,Crypto,ethereum
https://api.github.com/repos/bmino/binance-triangle-arbitrage,binance-triangle-arbitrage,Detect in-market cryptocurrency arbitrage,JavaScript,Crypto,binance
https://api.github.com/repos/rocket-pool/rocketpool,rocketpool,A next generation decentralised Ethereum proof of stake (POS) pool currently in Alpha and built to be compatible with Casper.,JavaScript,Crypto,ethereum
https://api.github.com/repos/EOSEssentials/EOSTracker,EOSTracker,EOS Tracker: Real time viewer for EOS Blockchain,TypeScript,Others,eos
https://api.github.com/repos/floating/frame,frame,A cross-platform Ethereum provider interface,,Others,ethereum
https://api.github.com/repos/moneroexamples/onion-monero-blockchain-explorer,onion-monero-blockchain-explorer,,C++,Others,monero
https://api.github.com/repos/PaulLaux/eth-hot-wallet,eth-hot-wallet,Ethereum Hot Wallet,JavaScript,Crypto,ethereum
https://api.github.com/repos/stellar/kelp,kelp,Kelp is a free and open-source trading bot for the Stellar universal marketplace,Go,Crypto,stellar
https://api.github.com/repos/merlox/casino-ethereum,casino-ethereum,"This is a simple casino build with solidity, truffle and react",,Others,ethereum
https://api.github.com/repos/notgiven688/webminerpool,webminerpool,monero web-miner for webminerpool.com,,Crypto,monero
https://api.github.com/repos/gnosis/safe-contracts,safe-contracts,Gnosis Safe allows secure management of blockchain assets. ,Solidity,Others,ethereum
https://api.github.com/repos/nanotube/supybot-bitcoin-marketmonitor,supybot-bitcoin-marketmonitor,Some bitcoin and supybot-related code. ,Python,Crypto,bitcoin
https://api.github.com/repos/bitquest/bitquest,bitquest,A Minecraft server with Bitcoin economy,Java,Crypto,multi
https://api.github.com/repos/IBM/Decentralized-Energy-Composer,Decentralized-Energy-Composer,A decentralized energy network implementing Blockchain transactions using Hyperledger Composer ,TypeScript,Others,hyperledger fabric
https://api.github.com/repos/arcbit/arcbit-ios,arcbit-ios,arcbit - bitcoin wallet  http://arcbit.io,Swift,Crypto,bitcoin
https://api.github.com/repos/LiskHQ/lisk-explorer,lisk-explorer,Lisk blockchain explorer,JavaScript,Others,others
https://api.github.com/repos/dydxprotocol/protocol,protocol,Solidity Smart Contracts for the dYdX Margin Trading Protocol,JavaScript,Crypto,ethereum
https://api.github.com/repos/stellarterm/stellarterm,stellarterm,Advanced web based trading client for the Stellar network. ????????????????,JavaScript,Crypto,stellar
https://api.github.com/repos/achow101/forkmon,forkmon,A Django project to monitor the status of potential forks in Bitcoin.,,Others,bitcoin
https://api.github.com/repos/thousandetherhomepage/ketherhomepage,ketherhomepage,Own a piece of blockchain history!,,Others,ethereum
https://api.github.com/repos/balance-io/balance-manager,balance-manager,Ethereum Wallet Manager Interface,JavaScript,Crypto,ethereum
https://api.github.com/repos/aws-samples/non-profit-blockchain,non-profit-blockchain,"Builds a blockchain network and application to track donations to non-profit organizations, using the Amazon Managed Blockchain",CSS,Others,hyperledger fabric
https://api.github.com/repos/shesek/bwt,bwt,,Rust,Crypto,bitcoin
https://api.github.com/repos/cosmos/voyager,voyager,Cosmos Voyager — the user interface for the Cosmos Network. ✨,JavaScript,Crypto,cosmos
https://api.github.com/repos/AudiusProject/hedgehog,hedgehog,???? Build DApps like Apps -- A Metamask alternative that empowers you to build good UX,JavaScript,Crypto,ethereum
https://api.github.com/repos/btcontract/lnwallet,lnwallet,,,Crypto,bitcoin
https://api.github.com/repos/almindor/etherwall,etherwall,Ethereum QT5 Wallet,C++,Crypto,ethereum
https://api.github.com/repos/mynodebtc/mynode,mynode,The easiest way to run Bitcoin and Lightning!,HTML,Crypto,bitcoin
https://api.github.com/repos/ZeusLN/zeus,zeus,,,Crypto,bitcoin
https://api.github.com/repos/jpmorganchase/anonymous-zether,anonymous-zether,A private payment system for Ethereum-based blockchains.,JavaScript,Crypto,ethereum
https://api.github.com/repos/MrLuit/EtherScamDB,EtherScamDB,Keep track of all current ethereum scams in a large database,JavaScript,Others,ethereum
https://api.github.com/repos/indyjo/bitwrk,bitwrk,"A Bitcoin-friendly, Anonymous Marketplace for Computing Power",Go,Others,bitcoin
https://api.github.com/repos/arthurgervais/Bitcoin-Simulator,Bitcoin-Simulator,,C++,Others,bitcoin
https://api.github.com/repos/rstormsf/multisender,multisender,This Dapp allows to send ERC20 tokens in batches,,Crypto,ethereum
https://api.github.com/repos/ripplerm/ripple-wallet,ripple-wallet,,JavaScript,Crypto,ripple
https://api.github.com/repos/greenaddress/abcore,abcore,ABCore - Android Bitcoin Core,Java,Others,bitcoin
https://api.github.com/repos/interstellar/starlight,starlight,Payment channels on Stellar,Go,Crypto,stellar
https://api.github.com/repos/greenaddress/GreenBits,GreenBits,GreenBits is a Bitcoin Wallet for Android provided by GreenAddress,Java,Crypto,bitcoin
https://api.github.com/repos/miguelmota/go-ethereum-hdwallet,go-ethereum-hdwallet,,,Crypto,ethereum
https://api.github.com/repos/stellar/stellar-wallet,stellar-wallet,Holds encrypted data. Used by stellar-client to store the user's key in a secure way. ,JavaScript,Crypto,stellar
https://api.github.com/repos/CovenantSQL/CovenantForum,CovenantForum,CovenantForum is a simple Decentralized forum powered by CovenantSQL.,Go,Others,others
https://api.github.com/repos/alexk111/DeBitpay,DeBitpay,"DeBitpay is a simple app which decodes Bitpay payment links into Bitcoin transaction requirements, so that you could make the payments with Bitcoin wallets not supporting Bitpay.",JavaScript,Crypto,bitcoin
https://api.github.com/repos/blockchain-desktop/hyperledger-fabric-desktop,hyperledger-fabric-desktop,超级账本fabric桌面客户端,JavaScript,Others,hyperledger fabric
https://api.github.com/repos/OttoAllmendinger/gnome-shell-bitcoin-markets,gnome-shell-bitcoin-markets,,JavaScript,Crypto,bitcoin
https://api.github.com/repos/KyberNetwork/KyberSwap,KyberSwap,"Codebase for KyberSwap that helps users convert tokens instantly and directly from their own hardware wallets, metamask and so on. No setup, No deposit, no withdrawal needed. Try it out on https://kyber.network/swap",JavaScript,Crypto,ethereum
https://api.github.com/repos/state-of-the-dapps/sotd-www,sotd-www,State of the DApps - Website,Vue,Others,multi
https://api.github.com/repos/decentraland/marketplace,marketplace,"????️ Decentraland LAND manager, wallet and marketplace",JavaScript,Others,decentraland
https://api.github.com/repos/IBM/android-kubernetes-blockchain,android-kubernetes-blockchain,**work-in-progress**,,Others,hyperledger fabric
https://api.github.com/repos/Bounties-Network/StandardBounties,StandardBounties,Smart Contracts in Solidity to serve as a Standard for Bounties for EVM dApps,JavaScript,Others,ethereum
https://api.github.com/repos/ElementsProject/filebazaar,filebazaar,Sell digital files with Bitcoin & Lightning :zap:,JavaScript,Others,bitcoin
https://api.github.com/repos/moscow-technologies/ag-blockchain,ag-blockchain,,,Others,ethereum
https://api.github.com/repos/mitmedialab/medrec,medrec,medical records on the blockchain,JavaScript,Others,ethereum
https://api.github.com/repos/WalletConnect/walletconnect-monorepo,walletconnect-monorepo,Walletconnect monorepo,,Crypto,ethereum
https://api.github.com/repos/MetaMask/metamask-mobile,metamask-mobile,Mobile web browser providing access to websites that use the Ethereum blockchain,JavaScript,Crypto,ethereum
https://api.github.com/repos/blk-io/blk-explorer-free,blk-explorer-free,Ethereum and Quorum private blockchain explorer,,Others,multi
https://api.github.com/repos/TrustWallet/dapps-browser,dapps-browser,DApps browser,JavaScript,Others,ethereum
https://api.github.com/repos/Hsiang-xxs/Auction,Auction,Auction smart contract and DApp,Vue,Others,ethereum
https://api.github.com/repos/Hsiang-xxs/Note-DApp,Note-DApp,A Note DApp on Ethereum,JavaScript,Others,ethereum
https://api.github.com/repos/district0x/name-bazaar,name-bazaar,A peer-to-peer marketplace for the exchange of names registered via the Ethereum Name Service,,Others,ethereum
https://api.github.com/repos/enKryptIO/ethvm,ethvm,ethereum block explorer,Vue,Others,ethereum
https://api.github.com/repos/limpbrains/django-cc,django-cc,Django wallet for Bitcoin and other cryptocurrencies,Python,Crypto,multi
https://api.github.com/repos/mmgen/mmgen,mmgen,lightweight online/offline Bitcoin wallet/cold storage solution for the command line,Python,Crypto,bitcoin
https://api.github.com/repos/wavesplatform/WavesExplorerLite,WavesExplorerLite,Pure AngularJS explorer for Waves Blockchain,,Others,waves
https://api.github.com/repos/okex/okchain,okchain,The Infrastructure of Decentralized Exchange,Go,Crypto,cosmos
https://api.github.com/repos/decred/dcrdata,dcrdata,"Decred block explorer, with packages and apps for data collection and storage. Written in Go.",Go,Others,decred
https://api.github.com/repos/decred/dcrstakepool,dcrstakepool,Stake Pool for Decred,,Crypto,decred
https://api.github.com/repos/Atrides/xmr-proxy,xmr-proxy,Stratum Proxy for Monero-pools,Python,Crypto,monero
https://api.github.com/repos/obsidiansystems/ledger-app-tezos,ledger-app-tezos,Ledger app for Tezos,,Crypto,tezos
https://api.github.com/repos/pandonetwork/pando,pando,"A distributed VCS based on IPFS, ethereum and aragonOS",JavaScript,Others,ethereum
https://api.github.com/repos/craigwatson/bitcoind-status,bitcoind-status,PHP application to display status and information from the Bitcoin node daemon.,CSS,Others,bitcoin
https://api.github.com/repos/interledgerjs/moneyd,moneyd,ILP Provider using XRP payment channels,JavaScript,Crypto,xrp
https://api.github.com/repos/cpacia/BitcoinCash-Wallet,BitcoinCash-Wallet,Bitcoin Cash P2P SPV Wallet,,Crypto,bitcoin cash
https://api.github.com/repos/jsappme/tradingview-alert-binance-trader,tradingview-alert-binance-trader,this trading bot listens to the TradingView alert email on your inbox and execute a trade based on the parameters set on the TD alerts.,,Crypto,binance
https://api.github.com/repos/BlockABC/eos-tokens,eos-tokens,The ultimate collection of all EOS tokens (PR welcome!).,,Crypto,eos
https://api.github.com/repos/scorelab/ChainKeeper,ChainKeeper,Web platform to analyze crypto blockChain ,,Others,multi
https://api.github.com/repos/blockchain/Android-Merchant-App,Android-Merchant-App,Blockchain Android Merchant App,Java,Crypto,bitcoin
https://api.github.com/repos/labscoin/coinomi,coinomi,Coinomi's cryptocurrency wallet for Android.,Java,Crypto,multi
https://api.github.com/repos/DAVFoundation/xplore,xplore,⛓ A block explorer for local Ethereum testnets,JavaScript,Others,ethereum
https://api.github.com/repos/Sparklemobile/Sparkle-Crowdsale,Sparkle-Crowdsale,Sparkle a decentralized token created on the Ethereum network.,JavaScript,Others,ethereum
https://api.github.com/repos/vacuumlabs/adalite,adalite,A lightweight wallet for Cardano cryptocurrency,HTML,Crypto,cardano
https://api.github.com/repos/mempool/mempool,mempool,Realtime Bitcoin blockchain explorer and mempool visualizer,TypeScript,Others,bitcoin
https://api.github.com/repos/IBM/evote,evote,A voting application that leverages Hyperledger Fabric and the IBM Blockchain Platform to record and tally ballots.,JavaScript,Others,hyperledger fabric
https://api.github.com/repos/WeTrustPlatform/rosca-contracts,rosca-contracts,Ethereum Contracts for WeTrust ROSCA,,Others,ethereum
https://api.github.com/repos/Havven/havven,havven,Havven Solidity smart contracts,Python,Others,ethereum
https://api.github.com/repos/CityOfZion/neo-scan,neo-scan,Blockchain explorer for NEO,Elixir,Others,neo
https://api.github.com/repos/IOTA-Ledger/blue-app-iota,blue-app-iota,Iota wallet application for Ledger Blue and Nano S ,,Crypto,iota
https://api.github.com/repos/Ayms/bitcoin-transactions,bitcoin-transactions,"Create and send by your own your Bitcoin, Bitcoin Cash, Bitcoin Gold, Zcash, etc transactions, manage your keys and do not disclose them to dubious wallets sw",,Crypto,multi
https://api.github.com/repos/EOSIO/eosio-explorer,eosio-explorer,An application providing Web GUI to communicate with EOSIO blockchain in a local development environment.,JavaScript,Others,eos
https://api.github.com/repos/ubiratansoares/blockked,blockked,Blockked - blockchain.info companion (and educational) app for Android ,Kotlin,Others,bitcoin
https://api.github.com/repos/naddison36/tx2uml,tx2uml,Ethereum transaction visualizer. Generates UML sequence diagram for a transaction's contract calls.,TypeScript,Others,ethereum
https://api.github.com/repos/electrumsv/electrumsv,electrumsv,A desktop wallet for Bitcoin SV,,Crypto,bitcoin sv
https://api.github.com/repos/IBM/blockchainbean,blockchainbean,Tracking coffee bean purchases with blockchain,,Others,hyperledger fabric
https://api.github.com/repos/jtgrassie/monero-pool,monero-pool,,C++,Crypto,monero
https://api.github.com/repos/cryptofinance-ai/cryptofinance-google-sheets-add-on,cryptofinance-google-sheets-add-on,The easiest way to get cryptocurrencies prices and more in your Google Sheets.,JavaScript,Crypto,bitcoin
https://api.github.com/repos/Whalepool/Bitcoin-Volume-Validator,Bitcoin-Volume-Validator,,Python,Crypto,bitcoin
https://api.github.com/repos/mmick66/jswallet,jswallet,An experimental Bitcoin Wallet in Electron + React.js,,Crypto,bitcoin
https://api.github.com/repos/notadamking/Bitcoin-Trader-RL,Bitcoin-Trader-RL,A profitable cryptocurrency trading environment using deep reinforcement learning and OpenAI's gym,,Crypto,bitcoin
https://api.github.com/repos/cybercongress/go-cyber,go-cyber,"A Consensus Supercomputer for computing relevance in web3, built with Cosmos-SDK & CUDA #fuckgoogle",Go,Others,cosmos
https://api.github.com/repos/lukacci/deltabot,deltabot,????Binance p&d (pump and dump) bot. ????Best profits. Fastest ever.  ,Python,Crypto,binance
https://api.github.com/repos/DecentricCorp/Coval-Unspecified-Ml-Blockchain,Coval-Unspecified-Ml-Blockchain,,,Others,ethereum
https://api.github.com/repos/Kava-Labs/kava,kava,A decentralized fast-finality blockchain for interoperable payment channel networks.,Go,Crypto,cosmos
https://api.github.com/repos/Synthetixio/synthetix,synthetix,Synthetix Solidity smart contracts,JavaScript,Others,synthetix
https://api.github.com/repos/chrisabruce/maelstrom,maelstrom,High Performance Email Server written in Go.,,Others,ethereum
https://api.github.com/repos/cryptoadvance/specter-desktop,specter-desktop,(Work In Progress) A desktop GUI for Bitcoin Core optimised to work with airgapped hardware wallets,Python,Others,bitcoin
https://api.github.com/repos/anshulshah96/CrowdBank,CrowdBank,⚙️ Peer to Peer Loan System implemented on Ethereum Smart Contracts,JavaScript,Crypto,ethereum
https://api.github.com/repos/EOSIO/eosio-reference-ios-authenticator-app,eosio-reference-ios-authenticator-app,iOS reference app demonstrating inter-application transaction signing for EOSIO blockchain apps,Swift,Others,eos
https://api.github.com/repos/CryptoLions/EOS-Network-monitor,EOS-Network-monitor,EOS Network Monitor,JavaScript,Others,eos
https://api.github.com/repos/airswap/contracts,contracts,AirSwap Ethereum Smart Contracts,,Crypto,ethereum
https://api.github.com/repos/IBM/customer-loyalty-program,customer-loyalty-program,A customer loyalty program with blockchain using Hyperledger Composer API,JavaScript,Others,hyperledger fabric
https://api.github.com/repos/JoinColony/purser,purser,Interact with Ethereum wallets easily,JavaScript,Crypto,ethereum
https://api.github.com/repos/EOSLaoMao/BankofStaked-CE,BankofStaked-CE,A smart contract to enable CPU&NET leasing on EOS,,Others,eos
https://api.github.com/repos/qtumproject/qtum-electrum,qtum-electrum,,Python,Crypto,qtum
