url,name,description,language,Category,blockchain
https://api.github.com/repos/dgpv/SASwap_TLAplus_spec,SASwap_TLAplus_spec,TLA+ specification for Succinct Atomic Swap smart contract,TLA,Others,bitcoin
https://api.github.com/repos/guoshijiang/blockchain-wallet-sdk,blockchain-wallet-sdk,区块链钱包Node SDK，包含所有数字货币的地址私钥生成，私钥管理，交易签名，发起转账等内容,,Crypto,others
https://api.github.com/repos/HydroProtocol/nights-watch,nights-watch,make getting updates from blockchain easier,,Others,ethereum
https://api.github.com/repos/TheDoctorAI/AI-Trader,AI-Trader,Bitcoin / Crypto AI Trading Bot,,Crypto,bitcoin
https://api.github.com/repos/aragon/convert.aragon.org,convert.aragon.org,Bonding Curve UI Converter microsite,JavaScript,Others,ethereum
https://api.github.com/repos/blockfirm/pine-app,pine-app,???? Pine is an open-source bitcoin wallet for sending and receiving money among your friends.,JavaScript,Crypto,bitcoin
https://api.github.com/repos/dubalol/bitcoin-tracker,bitcoin-tracker,,JavaScript,Crypto,bitcoin
https://api.github.com/repos/pgrimaud/lametric-bitcoin-realtime,lametric-bitcoin-realtime,"This application updates every 5 seconds the Bitcoin price from Bitstamp or Bitfinex, bitcoin exchanges.",PHP,Crypto,bitcoin
https://api.github.com/repos/lacksfish/insure-gui,insure-gui,GUI program for bitcoin cryptocurrency life insurance transactions,,Others,bitcoin
https://api.github.com/repos/warashibe/next-dapp,next-dapp,The Bridge between Web 2.0 and 3.0,JavaScript,Others,uniswap
https://api.github.com/repos/interledgerjs/ilp-plugin-xrp-asym-server,ilp-plugin-xrp-asym-server,Server for Asymmetric XRP Paychan,,Others,xrp
https://api.github.com/repos/CryptoLions/roshambo-EOS-contract,roshambo-EOS-contract,roshambo - rock paper scissors game for EOS,,Others,eos
https://api.github.com/repos/liquidity-network/nocust-contracts-solidity,nocust-contracts-solidity,NOCUST single commit chain verifier implemented in solidity,,Others,ethereum
https://api.github.com/repos/kaplanmaxe/stellar-cli,stellar-cli,"Lightweight, CLI wallet for Stellar Lumens",,Crypto,stellar
https://api.github.com/repos/globaltoken/globaltoken,globaltoken,Globaltoken Source Code based on Satoshi Nakamotos Bitcoin Core,,Crypto,bitcoin
https://api.github.com/repos/mikeyrf/nucleo,nucleo,Social banking on the Stellar network.,,Others,stellar
https://api.github.com/repos/BitcoinJake09/SatoshiQuest,SatoshiQuest,A Minecraft Tressure hunt for Bitcoin!,Java,Others,bitcoin
https://api.github.com/repos/igreshev/lightning-poker,lightning-poker,Bitcoin Lightning Network No Limit Texas Hold'em Poker,JavaScript,Others,bitcoin
https://api.github.com/repos/jlopp/us-marshals-bitcoin-auctions,us-marshals-bitcoin-auctions,Keeping track of all bitcoin seized and sold by the US Marshals,,Crypto,bitcoin
https://api.github.com/repos/Augmint/augmint-contracts,augmint-contracts,Augmint Solidity Contracts,JavaScript,Others,ethereum
https://api.github.com/repos/teamzednode/gingerbread,gingerbread,Dashboard for Tezos Bakers,JavaScript,Others,tezos
https://api.github.com/repos/chainapsis/keplr-extension,keplr-extension,Keplr is a browser extension wallet for the Inter blockchain ecosystem.,TypeScript,Crypto,multi
https://api.github.com/repos/canokaue/ImmunoLynk,ImmunoLynk,[MIT Hack] COVID Immunity testing results registered to the Blockchain for healthcare safety.,Python,Others,multi
https://api.github.com/repos/CryptoLions/EOS-Network-Monitor-back,EOS-Network-Monitor-back,EOS Network Monitor backend,,Others,eos
https://api.github.com/repos/UniswapEx/exchange,exchange,Limit orders on top of uniswap ,JavaScript,Crypto,uniswap
https://api.github.com/repos/WietseWind/XRPTipBot-App,XRPTipBot-App,XRP TipBot app for Android and iOS ,,Crypto,xrp
https://api.github.com/repos/juaiglesias/ehrecords-hyperledger-blockchain,ehrecords-hyperledger-blockchain,Electronic Health Records blockchain implemented using Hyperledger Fabric framework.,JavaScript,Others,hyperledger fabric
https://api.github.com/repos/passWallet/Towan,Towan,Little open source project to manage your bitcoin public address.,CSS,Others,bitcoin
https://api.github.com/repos/monero-ecosystem/monero-java-rpc,monero-java-rpc,Monero wallet Java implementation,Java,Crypto,monero
https://api.github.com/repos/rwaltzsoftware-org/coffee-supplychain-ethereum,coffee-supplychain-ethereum, Implementation of coffee supplychain using ethereum smart contract addressing the issue of storing critical data necessary at different stages of supplychain and making it verifiable by all stakeholders in supplychain.,JavaScript,Others,ethereum
https://api.github.com/repos/crate-crypto/MLSAG,MLSAG,Multilayered Linkable Spontaneous Anonymous Group - Implemented as is from paper. Not Monero specific,Rust,Others,monero
https://api.github.com/repos/maeck70/iritop,iritop,Simple Iota IRI Node Monitor,,Others,iota
https://api.github.com/repos/MrToph/cryptoship-contract,cryptoship-contract,EOS smart contract for the cryptoship game,JavaScript,Others,eos
https://api.github.com/repos/Sifir-io/sifir-mobile-wallet,sifir-mobile-wallet,Sifir Mobile Bitcoin Wallet,JavaScript,Crypto,bitcoin
https://api.github.com/repos/Codiscite/peacock,peacock,Open source privacy-first browser that hosts your data on the blockchain.,HTML,Others,others
https://api.github.com/repos/balancer-labs/pool-management,pool-management,Pool management dapp,TypeScript,Crypto,ethereum
https://api.github.com/repos/willitscale/ethereum-adventure,ethereum-adventure,The Ethereum Adventure Game,,Others,ethereum
https://api.github.com/repos/scr53005/eftg-steem,eftg-steem,Implementing the European Financial Transparency Gateway on a modified Steem blockchain,,Others,others
https://api.github.com/repos/zcash/zcash-ios-wallet,zcash-ios-wallet,iOS version of the ECC Wallet,Swift,Crypto,zcash
https://api.github.com/repos/mojojojo20/ColdBlocks,ColdBlocks,:truck: :snowflake: Blockchain for Cold Chain Networks with IoT and Optimal Route Prediction,JavaScript,Others,hyperledger fabric
https://api.github.com/repos/unwindnl/GalacticBot,GalacticBot,Trade bot library for the Stellar platform.,,Crypto,stellar
https://api.github.com/repos/SouthbankSoftware/provendocs,provendocs,Provendocs is a blockchain enabled document storage service built on ProvenDB.,JavaScript,Others,others
https://api.github.com/repos/OCamlPro/tzscan,tzscan,The TzScan block explorer for Tezos,,Others,tezos
https://api.github.com/repos/makevoid/blockchain-pen,blockchain-pen,BlockchainPen it's an UI for writing messages to the blockchain.,JavaScript,Others,bitcoin
https://api.github.com/repos/NEMChina/nem_explorer_nodejs,nem_explorer_nodejs,,JavaScript,Others,nem
https://api.github.com/repos/ENS-Nifty/ens-nifty-frontend,ens-nifty-frontend,Frontend for ENS Nifty dapp,JavaScript,Others,ethereum
https://api.github.com/repos/zcash/zcash-android-wallet-poc,zcash-android-wallet-poc,Frontend Android code for the reference wallet,Kotlin,Crypto,zcash
https://api.github.com/repos/matnad/liquid-gas-token,liquid-gas-token,Liquid Gas Token (GST) for Ethereum,Solidity,Crypto,ethereum
https://api.github.com/repos/SiaHubLab/siahub,siahub,SiaHub - Siacoin network monitoring system,PHP,Others,siacoin
https://api.github.com/repos/ChristopherWMM/Terra,Terra,"A repository for Terra, my CS-112 Final project.",Java,Others,terra
https://api.github.com/repos/desmos-labs/desmos,desmos,Improving the well-being of users on social networks through the blockchain technology.,Go,Others,cosmos
https://api.github.com/repos/blockxlabs/enzyme,enzyme,A Polkadot Wallet,,Crypto,polkadot
https://api.github.com/repos/XuanMaoSecLab/DolphinChain,DolphinChain,DolphinChain is the first Vulerable Blockchain Application in the world!,,Others,cosmos
https://api.github.com/repos/kdmukai/gdax_bot,gdax_bot,gdax_bot - Micro dollar cost averaging for crypto,Python,Crypto,multi
https://api.github.com/repos/IndieSquare/pebblewallet,pebblewallet,Bitcoin Lightning Network wallet for iOS and Android written using native frameworks and Appcelerator Alloy Titanium,,Crypto,bitcoin
https://api.github.com/repos/dimensionofficial/InSight-Explorer,InSight-Explorer,Dimension blockchain browser,,Others,multi
https://api.github.com/repos/dimensionofficial/Nebula-DApp-Platform,Nebula-DApp-Platform,DApp for Dimension,WebAssembly,Others,ethereum
https://api.github.com/repos/curly60e/python-blockclock,python-blockclock,Bitcoin Blockclock ,Python,Others,bitcoin
https://api.github.com/repos/AdExNetwork/adex-dapp,adex-dapp,AdEx dapp UI (WIP),JavaScript,Others,ethereum
https://api.github.com/repos/deconet/DeconetSmartContracts,DeconetSmartContracts,Our smart contracts to sell and log license exceptions and API calls on the blockchain,HTML,Others,ethereum
https://api.github.com/repos/lich666dead/zil-pay,zil-pay,The ZilPay browser extension enables browsing Zilliqa blockchain enabled websites.,JavaScript,Others,zilliqa
https://api.github.com/repos/lunochkin/dex,dex,Decentralized blockchain 0x-based exchange,,Crypto,0x
https://api.github.com/repos/tberghuis/alerts-for-binance-pwa,alerts-for-binance-pwa,Get crypto price alerts,JavaScript,Crypto,binance
https://api.github.com/repos/gosuto-ai/candlestick_retriever,candlestick_retriever,Retrieve all historical candlestick data from crypto exchange Binance and upload it to Kaggle.,Python,Others,binance
https://api.github.com/repos/smoove/cli-crypto-charts,cli-crypto-charts,View cryptocurrency charts in your terminal,JavaScript,Others,multi
https://api.github.com/repos/musictie/musictie-coin,musictie-coin,Description of MusicTie Coin and Solidity codes,,Crypto,ethereum
https://api.github.com/repos/bumi/bundler-thankyou,bundler-thankyou,,,Others,bitcoin
https://api.github.com/repos/BlockAndJerrys/block-and-jerrys,block-and-jerrys,React Webapp using LND to serve ice cream to the Bitcoin Mainnet,JavaScript,Others,bitcoin
https://api.github.com/repos/kelvinlockwood/Rent-My-Tent,Rent-My-Tent,Blockchain for Social Impact: Decentralized Impact Incubator project,,Others,ethereum
https://api.github.com/repos/twodude/ghost-relay,ghost-relay,the GHOST protocol implementation on solidity.,Solidity,Others,ethereum
https://api.github.com/repos/GeonNetwork/geon-ethereum,geon-ethereum,Geon implementation on the Ethereum blockchain.,,Others,ethereum
https://api.github.com/repos/aragon/apm-serve,apm-serve,Web 2.0 server for Web 3.0 APM hosted dApps,JavaScript,Others,ethereum
https://api.github.com/repos/rkalis/radical.domains,radical.domains,Harberger taxes for ENS domains,TypeScript,Others,ethereum
https://api.github.com/repos/Bitcoin-Confidential/BitcoinC-Core,BitcoinC-Core,Bitcoin Confidential Core Wallet.   https://bitcoin-coinfidential.cc,,Crypto,bitcoin
https://api.github.com/repos/nknx-org/nknx,nknx,A smart blockchain explorer for NKN written in JScript/VueJS & Vuetify,CSS,Others,others
https://api.github.com/repos/itp-world/blockchain-otc-dapp,blockchain-otc-dapp,,,Others,ethereum
https://api.github.com/repos/AndreMiras/Etheroll,Etheroll,Provably fair dice game running on the Ethereum blockchain,JavaScript,Others,ethereum
https://api.github.com/repos/hoanghiephui/Bitcoin-Wallet,Bitcoin-Wallet,,,Crypto,bitcoin
https://api.github.com/repos/LocalCoinIS/LocalCoin-ui,LocalCoin-ui,Fully featured Graphical User Interface / Reference Wallet for the LocalCoin Blockchain,JavaScript,Crypto,others
https://api.github.com/repos/facebook-developer-circle-delhi/Smart-Wallet,Smart-Wallet,An ethereum based smart contract that splits the amount sent to it. It can be configured using a decentralized application.,,Crypto,ethereum
https://api.github.com/repos/Northeastern-University-Blockchain/EthCodeSpider,EthCodeSpider,A spider who can grab the information of smart contract in Ethereum，爬取以太坊智能合约,Python,Others,ethereum
https://api.github.com/repos/SouthbankSoftware/provenlogs,provenlogs,Prove logs on Blockchain with ProvenDB,,Others,others
https://api.github.com/repos/iost-official/explorer,explorer,IOST Blockchain explorer,,Others,iost
https://api.github.com/repos/UNSW-CEEM/NEMOSIS,NEMOSIS,(nem-data) -> NEMOSIS: NEM Open-source data service,Python,Others,nem
https://api.github.com/repos/ExodusMovement/bitcoind-zmq,bitcoind-zmq,Get ZMQ notifications from bitcoin-like coins,JavaScript,Others,bitcoin
https://api.github.com/repos/Cindercloud/Cindercloud,Cindercloud,Ethereum Chain Explorer,,Others,ethereum
https://api.github.com/repos/evolutionlandorg/tron-contracts,tron-contracts,Evolution Land contracts on TRON network,,Others,tron
https://api.github.com/repos/etherCrossroads/CrossroadsCoin,CrossroadsCoin,"CrossroadsCoin is a ERC-20 Token of ethereum, and it has some new feature: 1. exchanging ether and CRC implement by CRC contract; 2. automatically adjust the exchange rate by contract",,Crypto,ethereum
https://api.github.com/repos/olegabu/fabric-starter-admin-web,fabric-starter-admin-web,Admin web application for Hyperledger Fabric,,Others,hyperledger fabric
https://api.github.com/repos/commerceblock/mainstay,mainstay,Federated blockchain attestation daemon,Go,Others,bitcoin
https://api.github.com/repos/peppersec/erc20faucet,erc20faucet,ERC20 Faucet Token,JavaScript,Crypto,ethereum
https://api.github.com/repos/chenweizhe/pet_shop,pet_shop,a pet shop based on blockchain ,JavaScript,Others,ethereum
https://api.github.com/repos/dmikushin/bitrader,bitrader,Trading and Alering Service for Binance Cryptocurrency Exchange,,Crypto,binance
https://api.github.com/repos/zdai-io/zDai-mixer,zDai-mixer,zDai.io - confidential Dai transactions on Burner wallet,JavaScript,Crypto,dai
https://api.github.com/repos/Obee-Network/Obee-NetworkWeb,Obee-NetworkWeb,This is the demonstration website of ObeeNetwork blockchain Technology,HTML,Others,others
https://api.github.com/repos/IBM/Hyperledger-Fabric-for-Trusted-IoT,Hyperledger-Fabric-for-Trusted-IoT,,JavaScript,Others,hyperledger fabric
https://api.github.com/repos/paraswap/paraswap-sdk,paraswap-sdk,ParaSwap allows dApps and traders to get the best DEX liquidity by aggregating multiple markets and offering the best rates,TypeScript,Crypto,multi
https://api.github.com/repos/TEEXIO/Tora-Zilliqa,Tora-Zilliqa,"A TEE-based, Trusted Oracle",Python,Others,zilliqa
https://api.github.com/repos/ealmansi/ercy-bot,ercy-bot,ErcyBot: real-time feed of Ethereum token transfers in your Slack workspace.,JavaScript,Crypto,ethereum
https://api.github.com/repos/cryptape/re-birth,re-birth,A blockchain explorer cache server for Nervos Appchain.,Ruby,Others,others
https://api.github.com/repos/ConsenSys/EthereumRegistrationAuthority,EthereumRegistrationAuthority,,JavaScript,Others,ethereum
https://api.github.com/repos/HydroBlockchain/uniswap-bittrex-arbitrage,uniswap-bittrex-arbitrage,,Python,Crypto,uniswap
https://api.github.com/repos/fsiamp/dogeponny,dogeponny,Dogecoin faucet,,Crypto,dogecoin
https://api.github.com/repos/dapphub/ds-roles,ds-roles,Your dapp can have 256 roles. A user can have multiple roles. Roles define access to capabilities.,,Others,ethereum
https://api.github.com/repos/pcluchet/ERC20_fullstack,ERC20_fullstack,"fullstack implementation of a business logic (retail), using erc20 tokens and invoicing chaincode on top of hyperledger fabric",,Others,hyperledger fabric
https://api.github.com/repos/in-the-keyhole/byzantine-browser,byzantine-browser,KHS Blockchain Browser,JavaScript,Others,hyperledger fabric
https://api.github.com/repos/corda/node-explorer,node-explorer,Corda Node Explorer,JavaScript,Others,corda
https://api.github.com/repos/SpankChain/uniprice,uniprice,Estimate the $USD price of an ERC20 Token by getting its DAI price from Uniswap!,JavaScript,Crypto,multi
https://api.github.com/repos/yasuoyuhao/BitcoinBlockChainMinimalist,BitcoinBlockChainMinimalist,快速查詢各類區塊鏈資產價格，快速查詢比特幣、以太坊、Zcash錢包餘額。,,Others,multi
https://api.github.com/repos/arcbtc/epaper-btc-price-fetcher,epaper-btc-price-fetcher,"DARE I LOOK.? Good days/bad days, we all have to check the price of bitcoin. ",,Crypto,bitcoin
https://api.github.com/repos/lightningboss/stellar-wind,stellar-wind,Listen to the beauty of Stellar transactions,,Others,stellar
https://api.github.com/repos/endpass/endpass-wallet,endpass-wallet,"Lightweight, easy to use Ethereum wallet",,Crypto,ethereum
https://api.github.com/repos/EthereumCommonwealth/Galileo,Galileo,???? Ethereum compatible blockchain explorer ,,Others,ethereum
https://api.github.com/repos/smokenetwork/webapp,webapp,Web front-end to Smoke-Network Blockchain.,,Others,others
https://api.github.com/repos/Agoric/dapp-encouragement,dapp-encouragement,"A simple DApp that illustrates the UI, API server, and contract plumbing",JavaScript,Others,ethereum
https://api.github.com/repos/status-im/dreddit-dapp,dreddit-dapp,Distributed Reddit dApp using Embark,,Others,ethereum
https://api.github.com/repos/Knutakir/btc-value-cli,btc-value-cli,Get the current Bitcoin value CLI,JavaScript,Crypto,bitcoin
https://api.github.com/repos/lampshade9909/DiamondSetter,DiamondSetter,Ethereum smart contract manager for the Diamond Standard,,Others,ethereum
https://api.github.com/repos/Sundly/sundly,sundly,???? Encrypted & decentralized personal health records. Built on Blockstack and powered by Blockchain.,JavaScript,Others,others
https://api.github.com/repos/unchained-capital/bitcoin-multisig,bitcoin-multisig,"Bitcoin 2/3-multisig dApp for cold storage, hardware wallets.",Python,Crypto,bitcoin
https://api.github.com/repos/qtumproject/qtum-explorer,qtum-explorer,,JavaScript,Others,qtum
https://api.github.com/repos/ramoslin02/binance_grid_trader,binance_grid_trader,A grid strategy trader on Binance Exchange. 币安交易所的网格交易,Python,Crypto,binance
https://api.github.com/repos/ExodusMovement/bitcoin-fee,bitcoin-fee,,,Crypto,bitcoin
https://api.github.com/repos/empatogen/woocommerce-xrp,woocommerce-xrp,,PHP,Crypto,xrp
https://api.github.com/repos/chronologic/chronos-dapp,chronos-dapp,Dapp to help you in deploying your own version of DAY token,HTML,Crypto,ethereum
https://api.github.com/repos/eostoken/eosrex,eosrex,An open source dapp of rex,,Others,eos
https://api.github.com/repos/scala-network/Scala,Scala,A cryptocurrency aiming to use blockchain technologies to globally distribute wealth.,C++,Others,others
https://api.github.com/repos/Bitcoin-com/bitcoin-cash-merchant-ios,bitcoin-cash-merchant-ios,Bitcoin Cash Merchant App (iOS),Swift,Others,bitcoin cash
https://api.github.com/repos/acloudfan/Blockchain-Course-ERC20-CourseToken,Blockchain-Course-ERC20-CourseToken,Demonstrates the use of ECR20 Standard for creating a Token Contract,JavaScript,Crypto,ethereum
https://api.github.com/repos/poliha/stellar-tokens,stellar-tokens,,,Crypto,stellar
https://api.github.com/repos/WeBankFinTech/weid-contract,weid-contract,"The solidity smart contract of WeIdentity, including DID, CPT, Authority and Specific Issuers.",,Others,ethereum
https://api.github.com/repos/morelazers/burner-choo,burner-choo,minimum viable ethereum burner wallet in choojs,JavaScript,Crypto,ethereum
https://api.github.com/repos/moneroexamples/generic-xmr-scanner,generic-xmr-scanner,Generic Monero Scanner of Monero blockchain,C++,Others,monero
https://api.github.com/repos/dvdbng/memwallet,memwallet,"like WarpWallet but for Ethereum, Litecoin, Monero and Bitcoin",,Crypto,multi
https://api.github.com/repos/DaoCasino/dc-blockchain,dc-blockchain,DAO.Casino blockchain - empowering Gambling 3.0,C++,Others,others
https://api.github.com/repos/cfelde/AKAP,AKAP,"AKA protocol, the LDAP of Ethereum",JavaScript,Others,ethereum
https://api.github.com/repos/Blockdaemon/hlf-database-app,hlf-database-app,Skeleton for building a Hyperledger Fabric database app,Go,Others,hyperledger fabric
https://api.github.com/repos/ephremdeme/voting,voting,voting using blockchain technology,,Others,others
https://api.github.com/repos/mappum/blockchain-download,blockchain-download,Download blockchain data from peers,JavaScript,Others,bitcoin
https://api.github.com/repos/callmewindow/financial-platform-with-blockchain,financial-platform-with-blockchain,基于区块链的供应链金融平台,JavaScript,Others,others
https://api.github.com/repos/levelkdev/BC-DAPP,BC-DAPP,,JavaScript,Others,ethereum
https://api.github.com/repos/archanova/solidity,solidity,Archanova solidity contracts,Solidity,Others,ethereum
https://api.github.com/repos/monkeylord/Bishop,Bishop,Build shops on Bitcoin.,,Others,bitcoin
https://api.github.com/repos/AlacrisIO/alacrity,alacrity,DSL for Secure DApps,,Others,ethereum
https://api.github.com/repos/anrodon/nem-microwallet,nem-microwallet,NEM Blockchain Chrome Extension wallet,JavaScript,Crypto,nem
https://api.github.com/repos/input-output-hk/cardano-explorer,cardano-explorer,The new Cardano Explorer,Haskell,Others,cardano
https://api.github.com/repos/kunoada/Cardano,Cardano,Pool ticker: KUNO,Python,Crypto,cardano
https://api.github.com/repos/coinables/NoNodePay,NoNodePay,Simple Bitcoin Shopping Cart No Node,JavaScript,Others,bitcoin
https://api.github.com/repos/moneroexamples/onion-monero-viewer,onion-monero-viewer,,,Others,monero
https://api.github.com/repos/wintercooled/NodeMonitor-Python-Django,NodeMonitor-Python-Django,"A Python Django web dashboard that shows node status for Bitcoin, Lightning Network, Elements, Liquid",Python,Others,multi
https://api.github.com/repos/luca-moser/visualizer.iota-tangle.io,visualizer.iota-tangle.io,Code of visualizer.iota-tangle.io,TypeScript,Others,iota
https://api.github.com/repos/microsoft/EVM-for-CCF,EVM-for-CCF,Sample EVM application for CCF,C++,Others,ethereum
https://api.github.com/repos/coreyphillips/bitbip,bitbip,"Bitbip is an open-source, non-custodial, Bitcoin/Litecoin Electrum wallet for iOS & Android. ",,Crypto,multi
https://api.github.com/repos/lynnroth/EOSWeb,EOSWeb,Blazor app for working with ETC Eos over OSC,C#,Others,eos
https://api.github.com/repos/Philipp-p/DogeTracker,DogeTracker,"DogeTracker, an iOS app to keep track of your Dogecoin",Swift,Crypto,dogecoin
https://api.github.com/repos/imloama/maxToken,maxToken,A free and feature-rich digital asset wallet enabling multi-chain(BTCETHEOSXLMXRP) asset management like imToken,,Crypto,multi
https://api.github.com/repos/Zilliqa/ZRC,ZRC,Zilliqa Reference Contracts,,Others,zilliqa
https://api.github.com/repos/singnet/snet-marketplace-service,snet-marketplace-service,Serves as an index for use by the DApp. Provides a curated set of Services and its details,,Others,others
https://api.github.com/repos/Jacubeit/Bitcoin-MoneyMoney,Bitcoin-MoneyMoney,,,Crypto,bitcoin
https://api.github.com/repos/gnosis/dx-uniswap-arbitrage,dx-uniswap-arbitrage,,JavaScript,Crypto,uniswap
https://api.github.com/repos/awesome-mixin-network/bitcoin-cli-wallet-python,bitcoin-cli-wallet-python,bitcoin-cli-wallet-php,Python,Crypto,bitcoin
https://api.github.com/repos/stellar-fox/cygnus,cygnus,Enhanced Stellar Wallet,,Crypto,stellar
https://api.github.com/repos/Colm3na/polkastats-v2,polkastats-v2,Polkadot Kusama network statistics,Vue,Others,multi
https://api.github.com/repos/0age/create2crunch,create2crunch,A Rust program for finding salts that create gas-efficient Ethereum addresses via CREATE2.,Rust,Others,ethereum
https://api.github.com/repos/Dapp-rosetta/dapp-rosetta,dapp-rosetta,,C++,Others,ethereum
https://api.github.com/repos/BlocknetDX/block-dx,block-dx,BLOCK DX p2p exchange dapp,JavaScript,Others,ethereum
https://api.github.com/repos/wslyvh/buidl-explorer,buidl-explorer,Join the #BUIDL movement and contribute to open-source Ethereum projects,,Others,ethereum
https://api.github.com/repos/kleros/escrow,escrow,Decentralized Escrow - Ethereum Project,JavaScript,Others,ethereum
https://api.github.com/repos/coinfork/Marriage,Marriage,"This smart contract allows for marriage and divorce on the Ethereum blockchain with a monetary incentive to stay married for the full term, as well as a prisoner's dilemma to update the contract if a divorce were to happen.",,Others,ethereum
https://api.github.com/repos/greenthereum/greenthereum,greenthereum,"Free and Open Source Ethereum tracker and account explorer app,  built with React Native.",,Others,ethereum
https://api.github.com/repos/banteg/uniswap,uniswap,uniswap analytics,Python,Others,uniswap
https://api.github.com/repos/waellet/waellet,waellet,Waellet brings Aeternity blockchain to your browser.,JavaScript,Others,others
https://api.github.com/repos/BrightID/BrightID-SmartContract,BrightID-SmartContract,A smart contract to publish BrightID scores on Ethereum,,Others,ethereum
https://api.github.com/repos/Privatix/dapp-smart-contract,dapp-smart-contract,Privatix Service Contract (PSC),JavaScript,Others,ethereum
https://api.github.com/repos/mradkov/p2p-lending,p2p-lending,Peer 2 peer lending platform on Ethereum blockchain,JavaScript,Others,ethereum
https://api.github.com/repos/MichaelxhJiang/stellar-tip,stellar-tip,,JavaScript,Others,stellar
https://api.github.com/repos/HTMLCOIN/althash-web-platform,althash-web-platform,New hub for wallets and Dapps on Althash Blockchain,Vue,Crypto,others
https://api.github.com/repos/ryanio/truffle-mint-dai,truffle-mint-dai,Demonstration repo to show how you can mint your own forked Mainnet Dai using Truffle.,JavaScript,Crypto,dai
https://api.github.com/repos/christopher-siewert/deribit-arbitrage-monitor,deribit-arbitrage-monitor,"This program tracks the Deribit bitcoin derivatives exchange, looking for arbitrage profits",JavaScript,Crypto,bitcoin
https://api.github.com/repos/lbtcio/lbtc-explorer,lbtc-explorer,The official Lightning Bitcoin Explorer,Vue,Others,bitcoin
https://api.github.com/repos/amany9000/Registrador,Registrador,A blockchain based land registry application.,JavaScript,Others,others
https://api.github.com/repos/Johnsavadkuhi/tron-walletex,tron-walletex,,,Crypto,tron
https://api.github.com/repos/firepacket/Trustfreemarket,Trustfreemarket,Trustfree bitcoin marketplace,C#,Others,bitcoin
